"rank","id","sharedMeaningId","label","definition","POS","japaneseTranslation","canonicalLine","dialogLineId","id","wordId","wordHeadId","wordRootId","wordInstanceId","wordUsageCount","headUsageCount","rootUsageCount","instanceUsageCount","headPick","rootPick","created","modified"
1,2454,1098,DO,to perform something,verb,～する,What can you do?,,4379,2454,37045,405098,137131,0,33120,18076,15656,0,0,2023-05-22 11:51:46.000,2023-05-22 11:51:46.000
2,23362,11080,YOUR,belonging to the person being spoken to,adjective,あなたの,Your boy is different.,,36471,23362,36659,204635,301881,0,17160,17124,22296,0,0,2023-05-22 11:51:46.000,2023-05-22 11:51:46.000
3,28962,14353,CAN,used to ask permission or make a request,auxiliary verb,～できる,Can you send it to me?,,44439,28962,29998,402405,39831,0,19065,16408,21011,1,1,2023-05-22 11:51:46.000,2024-07-08 09:12:27.000
4,1178,569,MY,of or belonging to me,pronoun,私の,My coffee has cream in it.,,155593,1178,36667,410989,284644,0,15455,98,18243,0,1,2023-05-22 11:51:46.000,2023-05-22 11:54:08.000
5,95488,2081,MAKE," to cause an action, feeling or situation",verb,,,,145764,95488,5,106678,4204,0,9486,0,1,0,1,2023-05-22 11:51:46.000,2024-02-28 12:58:27.000
5,2117,963,MAKE,to create something,verb,作る,We make French fries.,,3645,2117,5,106693,45192,0,9486,2123,1227,0,0,2023-05-22 11:51:46.000,2023-05-22 11:51:46.000
5,4828,2081,MAKE," to cause an action, feeling or situation",verb,（ある状態）にする,We will make America strong again.,,8292,4828,5,106695,42281,0,9486,4909,3453,0,0,2023-05-22 11:51:46.000,2023-05-22 11:51:46.000
6,49500,24647,PEOPLE,more than one person,noun,人々,The people were happy.,,80338,49500,10,412368,342394,0,12033,11663,14188,0,0,2023-05-22 11:51:46.000,2023-05-22 11:51:46.000
7,15654,6785,OR,used to show a choice between two or more things,conjunction,または,Do you like blue or red?,,25282,15654,39102,208993,43824,0,11094,10915,14261,1,1,2023-05-22 11:51:46.000,2024-07-08 09:46:16.000
8,10041,4034,LIKE,to enjoy or prefer something,verb,好きです,I like chocolate.,,15728,10041,29824,409778,39870,0,4843,3198,3275,0,0,2023-05-22 11:51:46.000,2023-05-22 11:51:46.000
8,38290,19094,LIKE,such as,preposition,〜のような,Mitsubishi's models are popular in countries like Thailand and the Philippines.,,59348,38290,36627,409783,53393,0,6452,1972,2325,0,1,2023-05-22 11:51:46.000,2024-07-08 06:56:56.000
8,38802,19368,LIKE,similar to someone or something,adverb,～みたい,"...people would say like,...",,60271,38802,36627,409779,93981,0,6452,4212,1042,0,0,2023-05-22 11:51:46.000,2023-05-22 11:51:46.000
9,3365,1444,GET,to experience something new,verb,なる,"Like it or not, Facebook's trademark ""Like"" button is set to get more expressive.",,6013,3365,3,407313,160023,0,6689,2614,1336,0,0,2023-05-22 11:51:46.000,2023-05-22 11:51:46.000
9,918,467,GET,to obtain or buy something,verb,～を得る,Time to get some lunch.,,1369,918,36500,448944,41928,0,3224,3224,1655,0,0,2023-05-22 11:51:46.000,2023-05-22 11:51:46.000
9,6304,2532,MOST,"the greatest amount, number, or part",noun,どれ、どちら,,,10446,6304,37048,429791,335256,0,4268,4220,17,0,0,2023-05-22 11:51:46.000,2023-05-22 11:51:46.000
9,6319,2532,INTO,involved with or interested in,preposition,どれ、どちら,,,10461,6319,37048,429791,335235,0,4268,4220,24,0,0,2023-05-22 11:51:46.000,2023-05-22 11:51:46.000
9,6334,2532,GOT,became,verb,どれ、どちら,,,10476,6334,37048,429791,335806,0,4268,4220,4,0,0,2023-05-22 11:51:46.000,2023-05-22 11:51:46.000
9,6337,2532,GET,become,verb,どれ、どちら,,,10479,6337,37048,429791,335244,0,4268,4220,12,0,0,2023-05-22 11:51:46.000,2023-05-22 11:51:46.000
9,6362,2532,A,used to say that a person or thing is better than someone or something,article,どれ、どちら,,,10518,6362,37048,429791,335224,0,4268,4220,327,0,0,2023-05-22 11:51:46.000,2023-05-22 11:51:46.000
10,1569,756,SAY,to express something using words,verb,言う、話す,"I say yes to this,...",,2533,1569,1,415078,41359,0,10629,8900,4159,0,0,2023-05-22 11:51:46.000,2023-05-22 11:51:46.000
11,38303,19102,OUR,belonging to a group that includes the speaker,adjective,私たちの,The reason I called you was to check and see if our order has been shipped.,,59364,38303,36570,205090,39921,0,8593,8457,10797,1,1,2023-05-22 11:51:46.000,2024-07-08 10:25:24.000
12,45332,22723,ONE,a person or thing from a group,pronoun,ひとつ,It's one of my passions and I would love to do a musical movie or whatsoever.,,71793,45332,976,411637,101530,0,10831,3101,3555,0,0,2023-05-22 11:51:46.000,2023-05-22 11:51:46.000
12,12913,5408,ONE,refers to a thing,adjective,ひとつの,"Okay, so there's one rule today.",,20744,12913,976,411638,42019,0,10831,5071,7313,0,0,2023-05-22 11:51:46.000,2023-05-22 11:51:46.000
13,26308,12632,ALL,every one or the whole amount of a thing,adjective,全ての,...that all men are created equal.,,40570,26308,4,400485,40193,0,8892,6008,8383,1,1,2023-05-22 11:51:46.000,2024-07-08 10:28:16.000
13,48848,24333,ALL,the whole amount of something,pronoun,すべての,"And I want to salute you, all of you, for your bravery and your courage.",,79001,48848,4,400484,42613,0,8892,1870,2117,0,0,2023-05-22 11:51:46.000,2024-05-03 09:18:50.000
14,18708,8277,WANT,to desire or wish for something,verb,望む,Have you decided what you want?,,30256,18708,18,418630,40170,0,8156,7300,7040,0,0,2023-05-22 11:51:46.000,2023-05-22 11:51:46.000
15,15151,6573,YES,a positive answer,noun,はい,"...that means 67 senators have to vote ""Yes.""",,24369,15151,29706,420067,5690,0,6903,2730,26,0,0,2023-05-22 11:51:46.000,2023-05-22 11:51:46.000
15,48493,24165,YES,used to give a positive answer,adverb,はい,"Yes, we do.",,78181,48493,29706,419133,40321,0,6903,4059,5089,0,0,2023-05-22 11:51:46.000,2023-05-22 11:51:46.000
16,49495,24643,MORE,of a greater amount or degree,adverb,もっと、もっと多く,Tell me more about your mother.,,80316,49495,17,410832,365392,0,7580,4583,6472,0,0,2023-05-22 11:51:46.000,2023-05-22 11:51:46.000
16,62090,31599,MORE,additional,adjective,まだ他に、もっと,He earned 1900 times more than his typical worker.,,101055,62090,17,410833,331663,0,7580,2015,2228,0,1,2023-05-22 11:51:46.000,2024-07-01 12:57:25.000
17,1512,734,THINK,to have an idea or opinion about something,verb,思う,I think we might have a problem.,,2387,1512,9,417327,91563,0,9468,6803,7083,0,0,2023-05-22 11:51:46.000,2023-05-22 11:51:46.000
18,1462,717,USE,to put something to a particular purpose,verb,利用する,Five million people use it every month.,,2280,1462,24,418285,53990,0,7507,6330,4184,0,0,2023-05-22 11:51:46.000,2023-05-22 11:51:46.000
19,2364,1072,SEE,to look,verb,見る,I want to see those.,,4081,2364,13,415294,44119,0,8237,5523,5027,0,0,2023-05-22 11:51:46.000,2023-05-22 11:51:46.000
19,70029,36435,SEE,to discover,verb,見て知る,I want to see the other side.,,111968,70029,13,415299,129798,0,8237,877,857,0,0,2023-05-22 11:51:46.000,2023-05-22 11:51:46.000
20,49783,24792,VERY,to a great degree or extremely,adverb,とても,They're very interesting.,,80972,49783,36649,418444,324509,0,6422,6378,7955,0,0,2023-05-22 11:51:46.000,2023-05-22 11:51:46.000
21,18610,8215,HIS,something that belongs to or is associated with a male,adjective,彼の,He is walking his dog.,,30145,18610,36708,206854,41685,0,6604,6376,7863,1,1,2023-05-22 11:51:46.000,2024-07-08 03:35:33.000
22,15649,6784,YEAR,a period of twelve months,noun,年,"In just over a year,...",,25260,15649,8,420064,41091,0,6388,6084,3243,0,0,2023-05-22 11:51:46.000,2024-07-08 10:32:35.000
23,12381,5139,MOST,to the greatest degree,adjective,最も,What was the most challenging part?,,19850,12381,36503,455585,60308,0,3968,2092,2935,1,1,2023-05-22 11:51:46.000,2024-07-08 10:30:17.000
24,1143,551,GO,to move or travel to a place,verb,行く,It's time to go home.,,1763,1143,2,407397,138327,0,8593,5959,4605,0,0,2023-05-22 11:51:46.000,2023-05-22 11:51:46.000
25,48672,24251,KNOW,to have information in your mind,verb,知る、わかっている,I know what you're thinking.,,78582,48672,6,409393,44516,0,7669,5627,6620,0,0,2023-05-22 11:51:46.000,2023-05-22 11:51:46.000
26,16112,7001,REALLY,used to stress something that is said,adverb,本当に,Cool! That sounds really interesting.,,26083,16112,29672,413920,87214,0,6383,5433,7218,0,0,2023-05-22 11:51:46.000,2023-05-22 11:51:46.000
27,49932,24847,NO,used to give a negative answer,interjection,いいえ,"No, I didn't.",,81327,49932,36719,204740,39571,0,4019,3875,5168,1,1,2023-05-22 11:51:46.000,2024-07-07 11:53:06.000
27,44261,22246,NO,not any,adjective,ひとつも〜ない,Her representatives had no immediate comment.,,69621,44261,36643,206022,19262,0,1560,1531,1812,0,0,2023-05-22 11:51:46.000,2023-05-22 11:51:46.000
28,25962,12455,NOW,at the current moment or time,adverb,今,Are you studying Spanish now?,,40094,25962,15,411386,27386,0,6659,5187,6970,0,0,2023-05-22 11:51:46.000,2023-05-22 11:51:46.000
29,16109,7000,THING,"an idea, event or action",noun,物事,There are some things money can't buy.,,26051,16109,28,417325,284143,0,5685,4993,2492,0,0,2023-05-22 11:51:46.000,2023-05-22 11:51:46.000
30,26534,12748,ALSO,in addition,adverb,また、も,We also like travelling.,,40911,26534,39107,400531,329033,0,4906,4906,6280,0,0,2023-05-22 11:51:46.000,2023-05-22 11:51:46.000
31,28420,13781,HERE,in this place,adverb,ここに,I live here.,,43556,28420,27,407987,127837,0,5784,4702,6313,0,0,2023-05-22 11:51:46.000,2023-05-22 11:51:46.000
32,49710,24757,WORK,a job that you are paid to do,noun,仕事,He likes to take time away from work.,,80780,49710,39,420038,42015,0,7295,1681,2414,0,0,2023-05-22 11:51:46.000,2023-05-22 11:51:46.000
32,2429,1095,WORK,to do a job ,verb,働く,They work a little harder...,,4255,2429,39,419043,112123,0,7295,2894,1497,0,0,2023-05-22 11:51:46.000,2023-05-22 11:51:46.000
33,48810,24316,NEW,different from before,adjective,新しい,I like the color of my new car.,,78900,48810,22,411196,287517,0,5545,1239,1427,0,0,2023-05-22 11:51:46.000,2023-05-22 11:51:46.000
33,49360,24579,NEW,recently made or introduced,adjective,新しい,It's fun to meet new people.,,80024,49360,22,411197,53072,0,5545,3291,4455,0,0,2023-05-22 11:51:46.000,2023-05-22 11:51:46.000
34,8124,3131,DAY,a period of time,noun,日,"Actually, I'm very busy that day.",,12847,8124,23,404335,104455,0,5464,4308,4016,0,0,2023-05-22 11:51:46.000,2023-05-22 11:51:46.000
35,67190,34806,WORLD,the earth and everything on it,noun,世界,The world has other universal languages.,,107788,67190,41,419054,47201,0,4952,4116,4808,0,0,2023-05-22 11:51:46.000,2023-05-22 11:51:46.000
36,239566,190162,THEN,next or after that,adverb,それから、その後,Then I go home.,,296807,239566,16,417272,41946,0,4833,3922,5032,1,1,2023-05-22 11:51:46.000,2024-07-08 05:13:18.000
37,49461,24624,GOOD," nice, helpful, or right",adjective,良い、優秀な,That's a good point.,,80236,49461,35,407421,98313,0,5443,3400,4433,1,1,2023-05-22 11:51:46.000,2024-07-08 03:35:43.000
37,35142,17427,GOOD,pleasant or enjoyable,adjective,良く,Give me a good book any day!,,54063,35142,35,77654,360586,0,5443,15,561,0,0,2023-05-22 11:51:46.000,2023-05-22 11:51:46.000
38,10200,4100,FIRST,before all others in a series,adjective,最初の,Is this your first time here?,,16056,10200,21,406625,333364,0,4998,3833,5036,0,0,2023-05-22 11:51:46.000,2023-05-22 11:51:46.000
39,77922,14525,WELL,used to begin or continue a statement,adjective,まあ、さて,"Well, you could get him a toy or some clothes.",,122265,77922,29842,418792,42253,0,3860,3857,5004,0,0,2023-05-22 11:51:46.000,2024-05-09 14:52:36.000
40,38966,19460,MANY,a large number of,adjective,たくさん、多くの,The world has so many lessons to teach you.,,60562,38966,36711,206367,41198,0,4223,3727,4789,1,1,2023-05-22 11:51:46.000,2024-07-07 22:55:06.000
41,73160,38254,TODAY,the present day,noun,今日,"That's all for today, thanks for watching.",,116347,73160,100,417513,41362,0,4130,1010,691,0,1,2023-05-22 11:51:46.000,2024-05-08 14:34:17.000
41,73164,38255,TODAY,on this day,adverb,今日,All of what we've examined today leads us to one conclusion:...,,116352,73164,100,417514,42209,0,4130,2656,3417,0,0,2023-05-22 11:51:46.000,2023-05-22 11:51:46.000
42,4845,2085,NEED,to must have or must do something,verb,必要とする,I need a suit for my job interviews.,,8342,4845,46,411115,304552,0,4687,3650,3684,0,0,2023-05-22 11:51:46.000,2023-05-22 11:51:46.000
43,38959,19455,RIGHT,an expression of approval,interjection,"なるほど, そうですね","Right, I think I understand.",,60550,38959,85,255423,209784,0,2587,370,394,0,0,2023-05-22 11:51:46.000,2023-05-22 11:51:46.000
43,47920,23893,RIGHT,correct,adjective,正しい,"Yes, that's right.",,76922,47920,85,414689,300737,0,2587,727,842,0,0,2023-05-22 11:51:46.000,2023-05-22 11:51:46.000
43,11058,4549,RIGHT,an action that is good and moral,noun,権利,You have a right to be angry.,,17371,11058,85,414686,1492,0,2587,431,175,0,0,2023-05-22 11:51:46.000,2023-05-22 11:51:46.000
43,41266,20717,RIGHT,precisely or exactly,adverb,ちょうど、ぴったり,"Oh, that's right.",,64328,41266,36268,414692,40014,0,1324,1265,2074,1,1,2023-05-22 11:51:46.000,2024-07-04 12:13:51.000
43,39550,19758,RIGHT,used to get approval or agreement,interjection,そうですよね,"Easy, right?",,61527,39550,85,237336,72167,0,2587,564,717,0,1,2023-05-22 11:51:46.000,2024-07-05 15:31:34.000
44,27509,13246,HELP,to give someone support,verb,手伝う、助ける,"Hi, how can I help you?",,42318,27509,69,407954,54949,0,4622,3238,3281,0,0,2023-05-22 11:51:46.000,2023-05-22 11:51:46.000
45,41969,21052,WAY,method,noun,方法,Find your way and build your character.,,65563,41969,19,418709,316494,0,4094,3273,3683,0,0,2023-05-22 11:51:46.000,2023-05-22 11:51:46.000
46,49915,24839,COUNTRY,a land ruled by its own leaders,noun,国,This country does allow you opportunities.,,81294,49915,68,403945,42448,0,3312,3224,2201,0,0,2023-05-22 11:51:46.000,2023-05-22 11:51:46.000
47,47769,23832,HIDE,to go to a secret place,verb,隠れる,She decided to hide there.,,76641,47769,1020,408017,104775,0,1186,834,817,1,1,2023-05-22 11:51:46.000,2023-05-22 11:54:08.000
47,25072,12006,HIDE,to not show onscreen,verb,,,,38841,25072,0,464932,395155,0,0,2589,2597,0,1,2023-05-22 11:51:46.000,2023-05-22 11:54:18.000
48,539,289,FIND,to discover something or someone,verb,見つける,"""Go and find some.""",,784,539,26,406578,56862,0,3860,3115,2426,0,0,2023-05-22 11:51:46.000,2023-05-22 11:51:46.000
49,4944,2116,CALL,to telephone or radio someone,verb,電話する,"So, should I call him?",,8514,4944,40,402377,334205,0,3698,630,352,0,0,2023-05-22 11:51:46.000,2023-05-22 11:51:46.000
49,384,223,CALL, to give someone or something a name,verb,呼ぶ,Please call me Linda.,,523,384,40,402371,47795,0,3698,2487,965,0,0,2023-05-22 11:51:46.000,2023-05-22 11:51:46.000
50,4612,1976,LOOK,to direct the eyes somewhere to see things,verb,見る,Look at me.,,7954,4612,20,409952,52865,0,3840,1341,933,0,0,2023-05-22 11:51:46.000,2023-05-22 11:51:46.000
50,45221,22676,LOOK,to have a certain image,verb,～に見える,It looks like the idea carries.,,71547,45221,20,409958,39498,0,3840,1809,1686,1,1,2023-05-22 11:51:46.000,2024-06-28 18:14:21.000
51,12219,5071,TELL,to say something,verb,教える、話す、伝える,"Okay, please tell us.",,19495,12219,31,417145,17113,0,3246,2909,2132,0,0,2023-05-22 11:51:46.000,2023-05-22 11:51:46.000
52,37474,18623,WHY,used to ask or talk about a reason,adverb,なぜ,Why is that?,,58046,37474,36564,418885,365430,0,2879,2842,3665,0,0,2023-05-22 11:51:46.000,2023-05-22 11:51:46.000
53,2025,929,TRY,to make an attempt,verb,やってみる、試す,Try this yourself.,,3506,2025,43,417878,48590,0,3072,2893,1921,1,1,2023-05-22 11:51:46.000,2024-07-05 13:55:51.000
54,12401,5147,GREAT,important or having high quality,adjective,大変な、偉大な,With great power comes great responsibility.,,19888,12401,62,407536,98309,0,3911,572,606,0,0,2023-05-22 11:51:46.000,2023-05-22 11:51:46.000
54,68056,35311,GREAT,very good or attractive,adjective,すばらしい,You have a great sense of humor.,,108947,68056,62,407537,39721,0,3911,2224,3013,1,1,2023-05-22 11:51:46.000,2024-07-04 15:23:54.000
55,1489,729,START,to begin to do something,verb,始める,I can start working on it right away.,,2333,1489,73,416514,298857,0,3593,2747,1663,0,0,2023-05-22 11:51:46.000,2023-05-22 11:51:46.000
56,15992,6957,LIFE,the state of being alive,noun,命、人生,"In life, it's important to know yourself.",,25808,15992,37,409743,41623,0,3673,1875,2051,0,0,2023-05-22 11:51:46.000,2023-05-22 11:51:46.000
56,15570,6753,LIFE,the period of being alive,noun,人生,It's important to enjoy life while you still can.,,25095,15570,37,409742,47850,0,3673,854,845,0,0,2023-05-22 11:51:46.000,2023-05-22 11:51:46.000
57,38385,19152,EVERY,referring to each thing within a group,adjective,毎,It happens every day.,,59485,38385,29628,405951,120684,0,3158,2704,3441,0,0,2023-05-22 11:51:46.000,2023-05-22 11:51:46.000
58,48821,24322,COMPANY,an organization that sells something,noun,会社、企業,How big is the company now?,,78933,48821,82,403329,40841,0,2725,2641,2184,1,1,2023-05-22 11:51:46.000,2024-07-08 10:33:52.000
59,2845,1265,GIVE,to offer or provide,verb,与える、贈る,Give me a good book any day!,,5002,2845,29,76065,70880,0,3829,2650,1852,1,1,2023-05-22 11:51:46.000,2024-07-05 13:55:33.000
60,42221,21173,DIFFERENT,not the same,adjective,違う、異なる,Your boy is different.,,66157,42221,116,404772,41214,0,2711,2534,3419,1,1,2023-05-22 11:51:46.000,2024-07-08 09:12:21.000
61,17442,7607,FEEL,to experience something physical,verb,感じる,I can't feel my legs.,,28511,17442,47,406467,77363,0,3490,618,323,0,1,2023-05-22 11:51:46.000,2024-06-11 13:16:14.000
61,3004,1322,FEEL,to have an emotion,verb,感じる,I understand how you feel about the low bonuses.,,5267,3004,47,406469,77387,0,3490,2005,1949,0,0,2023-05-22 11:51:46.000,2023-05-22 11:51:46.000
62,5,2,CHANGE,to become or cause to be different,verb,変える、変わる,Change the world.,,7,5,29850,402705,45612,0,2711,1814,1289,0,0,2023-05-22 11:51:46.000,2023-05-22 11:51:46.000
62,48478,24159,CHANGE,the result of becoming different,noun,変化,It's time for a change.,,78137,48478,29850,402701,68489,0,2711,729,431,0,1,2023-05-22 11:51:46.000,2024-06-24 13:50:09.000
63,62092,31601,ONLY,being just one and nothing else,adjective,ただ〜だけ,This is the only way to the city.,,101060,62092,30,411648,42345,0,3019,2502,3423,0,0,2023-05-22 11:51:46.000,2023-05-22 11:51:46.000
64,48917,24373,CITY,a big town,noun,都市,Madrid is a big city and it's really fun.,,79124,48917,154,402914,99519,0,2532,2519,2500,0,0,2023-05-22 11:51:46.000,2023-05-22 11:51:46.000
65,3064,1338,ALWAYS,at all times,adverb,いつも,My door is always open.,,5417,3064,93,400547,48697,0,2539,2537,3229,0,0,2023-05-22 11:51:46.000,2023-05-22 11:51:46.000
66,28958,14065,FOOD,the things that people and animals eat,noun,食べ物,They may give us some food.,,44416,28958,213,406862,116435,0,2404,2395,2855,0,0,2023-05-22 11:51:46.000,2023-05-22 11:51:46.000
67,39569,19770,TOO,also,adverb,も、もまた、こちらこそ,"I like it, too.",,61561,39569,36535,417553,90865,0,3529,2496,3193,0,0,2023-05-22 11:51:46.000,2023-05-22 11:51:46.000
68,8534,3324,LOVE,to like very much,verb,(大)好きである,I love birthday gifts.,,13481,8534,227,410018,292550,0,3120,2015,2175,0,0,2023-05-22 11:51:46.000,2023-05-22 11:51:46.000
68,5221,2198,LOVE,to feel affection for someone,verb,愛する,I love her.,,8965,5221,227,410020,296379,0,3120,419,364,0,0,2023-05-22 11:51:46.000,2023-05-22 11:51:46.000
69,18862,8356,LEARN,to gain knowledge or a skill,verb,習う、覚える,"Sure, I'd like to learn how to play golf.",,30521,18862,163,409602,309034,0,2673,2420,1762,0,0,2023-05-22 11:51:46.000,2023-05-22 11:51:46.000
70,47870,23877,NEXT,after the present time or place,adjective,次の,I'm going to visit New York City on my next vacation.,,76831,47870,1113,411209,321908,0,2797,2436,3088,0,0,2023-05-22 11:51:46.000,2023-05-22 11:51:46.000
71,2731,1222,COME,to arrive,verb,来る,When did you come to the States?,,4819,2731,14,403235,342557,0,3336,720,98,0,0,2023-05-22 11:51:46.000,2024-05-28 02:34:02.000
71,8693,3403,COME,to come to pass; take place,verb,やって来る,Who else is coming?,,13719,8693,14,403237,342538,0,3336,1762,1705,0,0,2023-05-22 11:51:46.000,2023-05-22 11:51:46.000
72,30112,14718,PRESIDENT,leader of a republic,noun,大統領,President Hosni Mubarak had stepped down.,,46118,30112,162,413124,48079,0,2980,2499,2649,0,0,2023-05-22 11:51:46.000,2023-05-22 11:51:46.000
73,2997,1321,LIVE,to have your home in a place,verb,住む,Where do you live?,,5246,2997,36229,409873,36404,0,1420,1420,947,0,0,2023-05-22 11:51:46.000,2023-05-22 11:51:46.000
73,23800,11294,LIVE,to spend one's life in a certain way,verb,暮す,"I'm gonna live like tomorrow doesn't exist, like it doesn't exist.",,37122,23800,96,409877,41404,0,1280,925,795,1,1,2023-05-22 11:51:46.000,2024-06-28 12:31:30.000
74,5737,2365,PLAY,to do something for fun,verb,遊ぶ,I play in the snow.,,9689,5737,29780,412704,125695,0,2505,456,285,0,1,2023-05-22 11:51:46.000,2024-05-24 05:02:28.000
74,12246,5085,PLAY,to make music,verb,演奏する,﻿I play the piano.,,19552,12246,29779,412706,58577,0,665,503,310,1,1,2023-05-22 11:51:46.000,2024-07-04 15:24:14.000
74,39412,19687,PLAY,to join a game or a sport,verb,(スポーツ・ゲームを)する,Sometimes we play at the tennis courts by our house.,,61301,39412,29780,412705,88217,0,2505,1357,1282,0,0,2023-05-22 11:51:46.000,2023-05-22 11:51:46.000
75,62968,32109,FRIEND,someone that you know and like,noun,友だち,I'm your friend.,,102358,62968,135,407085,39569,0,2727,2348,1099,0,0,2023-05-22 11:51:46.000,2024-07-07 18:30:30.000
76,3180,1378,BECOME,to begin to be something,verb,～になる,But with English you can become part of a wider conversation.,,5669,3180,50,401538,110803,0,2566,2238,1537,0,0,2023-05-22 11:51:46.000,2023-05-22 11:51:46.000
77,50106,24939,PLEASE,used to ask something politely,adverb,どうぞ～してください、お願いします,"Dinner's ready. Please, have a seat.",,81668,50106,521,412725,303440,0,2297,1977,2625,0,0,2023-05-22 11:51:46.000,2023-05-22 11:51:46.000
78,21436,9914,NEVER,not at any time,adverb,一度も〜ない、決して～ない,I've never been to Europe before.,,34041,21436,49,411194,41187,0,2200,2200,2900,0,0,2023-05-22 11:51:46.000,2023-05-22 11:51:46.000
79,16527,7158,IMPORTANT,with great value,adjective,重要な,How important is English to you?,,26913,16527,136,408496,46233,0,2237,2122,2821,0,0,2023-05-22 11:51:46.000,2023-05-22 11:51:46.000
80,11,3,SHOW,to let someone see,verb,見せる,I wanna show you something.,,34,11,75,415631,69105,0,1939,1339,1180,0,0,2023-05-22 11:51:46.000,2023-05-22 11:51:46.000
80,15640,6778,SHOW,a TV or radio program or a theater performance,noun,番組、ライブ,He is an actor in a TV show.,,25246,15640,75,415629,52837,0,1939,302,247,0,1,2023-05-22 11:51:46.000,2024-06-19 16:59:26.000
80,23758,11270,SHOW,to prove something to be true,verb,示す,Show them they are wrong.,,37058,23758,51344,415632,102013,0,583,518,160,0,0,2023-05-22 11:51:46.000,2024-04-29 07:50:26.000
81,51598,25596,ACTUALLY,something that is true,adverb,実は,"Actually, yes.",,84648,51598,1498,400196,306031,0,2431,2132,2876,0,0,2023-05-22 11:51:46.000,2023-05-22 11:51:46.000
82,43542,21884,FAMILY,people who are related,noun,家族,I prefer to be with my family.,,68386,43542,52,406333,123364,0,2248,2149,2149,0,0,2023-05-22 11:51:46.000,2023-05-22 11:51:46.000
83,49100,24469,MAN,a male adult,noun,男,The man drives his car.,,79500,49100,25,410188,41293,0,2463,2173,1791,1,1,2023-05-22 11:51:46.000,2024-07-03 14:17:27.000
84,92182,50596,AROUND,on all sides or from many directions,adverb,あちこちに,Look around.,,141198,92182,134,400911,121974,0,2614,1002,1552,0,0,2023-05-22 11:51:46.000,2023-05-22 11:51:46.000
84,49294,24547,AROUND,nearly or about,adverb,およそ,I get up at around 8 o'clock.,,79882,49294,134,400910,108359,0,2614,327,389,0,0,2023-05-22 11:51:46.000,2023-05-22 11:51:46.000
84,36806,18276,AROUND,over or in different parts,preposition,さまざまな部分の上または中,Tim draws around the cat.,,56902,36806,134,455940,378357,0,2614,2,860,0,1,2023-05-22 11:51:46.000,2023-05-22 11:54:16.000
85,49283,24544,WORD,a group of letters with meaning,noun,語、言葉,It's a very useful word to know.,,79855,49283,121,419031,67582,0,2291,2124,1104,0,0,2023-05-22 11:51:46.000,2023-05-22 11:51:46.000
86,49757,24780,MEAN,to have a particular meaning,verb,意味する,What does it mean?,,80904,49757,58,109089,65687,0,2714,1297,207,0,0,2023-05-22 11:51:46.000,2024-04-30 12:39:30.000
86,3249,1407,MEAN,to intend to say,verb,意図する、意味する,...please understand that I didn't mean what I said.,,5801,3249,58,410420,300328,0,2714,811,1025,0,0,2023-05-22 11:51:46.000,2023-05-22 11:51:46.000
87,49793,24796,PLACE,an area,noun,場所、所,Tina looked for a place to hide.,,81005,49793,51259,412646,41028,0,2076,2020,1947,1,1,2023-05-22 11:51:46.000,2024-07-08 10:31:19.000
88,49740,24772,LAST,the latest,adjective,最近の,I'm sure you forgot your last date.,,80853,49740,44,409506,51899,0,2359,1719,2221,1,1,2023-05-22 11:51:46.000,2024-07-08 10:31:46.000
88,50813,25257,LAST,final,adjective,最後に残った,The score was tied in the last inning.,,83066,50813,44,99526,57404,0,2359,316,369,0,0,2023-05-22 11:51:46.000,2023-05-22 11:51:46.000
89,34717,17226,PART,a piece of something,noun,一部、部分,This is my favorite part.,,53258,34717,36263,412162,63700,0,2230,2001,1935,1,1,2023-05-22 11:51:46.000,2024-07-08 01:49:13.000
90,51525,25564,STILL,continuing,adverb,(今でも)まだ,It's still dark.,,84507,51525,29685,171681,117575,0,2260,2046,2598,0,0,2023-05-22 11:51:46.000,2023-05-22 11:51:46.000
