"rank","id","sharedMeaningId","label","definition","POS","japaneseTranslation","canonicalLine","dialogLineId","id","wordId","wordHeadId","wordRootId","wordInstanceId","wordUsageCount","headUsageCount","rootUsageCount","instanceUsageCount","headPick","rootPick","created","modified"
697,49514,24654,MATERIAL,a substance that something is made from,noun,素材,This material feels soft.,,80366,49514,684,410369,41662,0,435,335,233,0,0,2023-05-22 11:51:46.000,2024-07-01 03:11:41.000
698,12034,5011,SUCCESSFUL,having the desired effect or result,adjective,成功した,The results of my experiment were really successful.,,18994,12034,755,416663,327048,0,917,130,139,0,1,2023-05-22 11:51:46.000,2024-04-29 12:59:00.000
698,19806,8933,SUCCESSFUL,"wealthy, famous or respected",adjective,成功した,You'll be successful one day if you roll up your sleeves soon.,,31868,19806,755,416664,52359,0,917,227,299,0,1,2023-05-22 11:51:46.000,2024-07-02 03:10:10.000
699,40076,20050,HORSE,a large animal used for riding,noun,馬,The horse runs fast.,,62356,40076,431,408221,129835,0,363,361,281,0,0,2023-05-22 11:51:46.000,2023-05-22 11:51:46.000
700,45764,22908,SENTENCE,words that express a complete idea,noun,文章,Let me give you an example sentence.,,72612,45764,1237,415375,150530,0,463,314,320,1,1,2023-05-22 11:51:46.000,2024-07-07 18:30:43.000
701,41636,20886,TOOL,things you use to do a job,noun,道具,Google is an incredible search tool on the Internet.,,64942,41636,1043,417557,45624,0,336,325,208,0,0,2023-05-22 11:51:46.000,2023-05-22 11:51:46.000
702,4151,1752,SUGGEST,to give an idea to be considered,verb,提案する,"If we do as you suggest, then it should not cost us too much.",,7232,4151,257,416701,55237,0,478,186,112,0,1,2023-05-22 11:51:46.000,2024-07-05 15:31:31.000
702,41179,20665,SUGGEST,to show that something is likely or true,verb,暗示する,"Well, I'd like to suggest there is no such thing as a left or right.",,64184,41179,257,416703,43028,0,478,159,91,0,0,2023-05-22 11:51:46.000,2023-05-22 11:51:46.000
703,40095,20061,INSPIRE,to make someone want to do something,verb,触発する、影響を与える,I inspire the greatest of them.,,62382,40095,1980,408849,299806,0,524,353,126,0,0,2023-05-22 11:51:46.000,2024-07-05 06:20:35.000
704,51388,25514,HEAVY,great in amount or degree than usual,adjective,激しい、重い,Korea has a really heavy rainy season.,,84241,51388,51365,407935,80625,0,301,225,274,1,1,2023-05-22 11:51:46.000,2024-06-19 17:08:08.000
704,41667,20902,HEAVY,difficult to pick up,noun,重い,Strong robots can lift and move heavy things easily.,,64988,41667,369,407938,363401,0,149,115,2,0,0,2023-05-22 11:51:46.000,2023-05-22 11:51:46.000
705,41622,20881,PULL,to hold something and move in a direction,verb,引く,My dogs pull me on my sled.,,64902,41622,286,413535,77444,0,447,260,200,1,1,2023-05-22 11:51:46.000,2024-07-04 15:24:20.000
705,16357,7100,PULL,to remove from a place with force,verb,取り除く、引き抜く,...as rescuers continue to pull bodies from flattened buildings.,,26551,16357,286,413534,36762,0,447,103,43,0,0,2023-05-22 11:51:46.000,2023-05-22 11:51:46.000
706,101191,56923,PROMISE,words that says you will do something,noun,約束,The king told her to keep her promise.,,153837,101191,1136,413369,41748,0,427,113,132,0,0,2023-05-22 11:51:46.000,2023-05-22 11:51:46.000
706,2011,923,PROMISE,to tell someone you will do something,verb,約束する,I think you should say sorry and promise not to do it again.,,3476,2011,1136,413372,44728,0,427,235,120,0,0,2023-05-22 11:51:46.000,2023-05-22 11:51:46.000
707,34351,17051,FINAL,the last game or level in a competition,noun,決勝戦,"Kei, congratulations, best of luck in the final.",,52581,34351,812,406562,312312,0,3068,71,50,0,1,2023-05-22 11:51:46.000,2024-06-18 05:15:13.000
707,197440,150501,FINAL, last in a series,adjective,最終の,"Final step, successful scheduling.",,252672,197440,812,406563,63280,0,3068,275,357,0,0,2023-05-22 11:51:46.000,2023-05-22 11:51:46.000
708,42210,21170,POLICY,way to act,noun,方針、政策,That is a good policy.,,66116,42210,226,412811,112064,0,353,345,251,0,0,2023-05-22 11:51:46.000,2023-05-22 11:51:46.000
709,47377,23666,NATURAL,not made by people,adjective,自然の,"In Chile, weeks of raging forest fires cause massive damage to the natural habitat of bees.",,75872,47377,710,411060,284189,0,917,342,442,1,1,2023-05-22 11:51:46.000,2024-05-21 09:58:33.000
710,39682,19828,CLAIM,to take something you own or deserve,verb,(得て当然のものを)得る,No one has claimed responsibility for the attack.,,61741,39682,807,402922,344598,0,454,85,39,0,0,2023-05-22 11:51:46.000,2023-05-22 11:51:46.000
710,49884,24828,CLAIM,to state something unproven to be true,verb,主張する,"They claim that the sauna takes away cold symptoms,...",,81211,49884,807,402927,72897,0,454,256,96,0,0,2023-05-22 11:51:46.000,2024-06-10 13:11:22.000
711,52253,25909,CRISIS,a difficult or dangerous situation,noun,危機,That crisis has now reached its third day.,,85996,52253,1287,404099,100205,0,350,350,387,0,0,2023-05-22 11:51:46.000,2023-05-22 11:51:46.000
712,70219,36543,DISH,food prepared in a particular way,noun,料理,"This dish, when I finished making it, it's very satisfying.",,112226,70219,1110,235496,70327,0,396,316,197,0,0,2023-05-22 11:51:46.000,2024-07-07 22:55:28.000
713,62185,31657,JUMP,to push your body upward,verb,跳ぶ,My dog can jump.,,101200,62185,484,409262,106098,0,488,352,263,1,1,2023-05-22 11:51:46.000,2024-06-25 02:07:42.000
714,16667,7216,INVOLVE,to include,verb,含む、巻き込む,I am sorry to involve you in this.,,27246,16667,689,409099,55164,0,501,348,23,0,0,2023-05-22 11:51:46.000,2023-05-22 11:51:46.000
715,16302,7081,MOON,the round object in the night sky,noun,月,The sun lights up the moon.,,26431,16302,1214,410816,43800,0,357,325,447,0,0,2023-05-22 11:51:46.000,2023-05-22 11:51:46.000
716,48409,24124,EASILY,without difficulty or effort,adverb,簡単に、間違いなく,I know that this won't be reached easily.,,77970,48409,344,405431,107395,0,1495,330,432,0,1,2023-05-22 11:51:46.000,2024-07-05 15:31:37.000
717,12383,5141,INDIVIDUAL,a single person,noun,個人,Whether you are an individual or an organization.,,19853,12383,745,408657,47394,0,373,173,59,0,0,2023-05-22 11:51:46.000,2024-04-25 14:44:29.000
717,46254,23122,INDIVIDUAL,related to a single person or thing,adjective,個人の,I don't really like individual sports like tennis or golf.,,73674,46254,745,408655,43053,0,373,159,211,1,1,2023-05-22 11:51:46.000,2024-07-05 06:20:42.000
718,42947,21547,RECENTLY,a short time ago,adverb,最近,"Recently, we got an advanced video conference system.",,67390,42947,357,413983,54710,0,722,343,413,0,1,2023-05-22 11:51:46.000,2024-07-02 15:02:01.000
719,16482,7142,DATE,to go out with someone you like,verb,デート,"You don't date, you don't go to parties, you don't hang out.",,26812,16482,30050,404322,324619,0,225,144,21,0,0,2023-05-22 11:51:46.000,2023-05-22 11:51:46.000
719,12484,5189,DATE,a specific day of the month or year,noun,日付,What date is it?,,20015,12484,466,404326,354565,0,214,193,218,0,0,2023-05-22 11:51:46.000,2023-05-22 11:51:46.000
720,13817,5877,REQUIRE,to make something necessary,verb,必要とする,It will require increased understanding...,,22307,13817,270,414407,66673,0,539,322,195,0,0,2023-05-22 11:51:46.000,2023-05-22 11:51:46.000
721,38986,19471,DRAW,to make a picture using a pen or pencil,verb,描く,He liked to draw so he made some cartoons.,,60596,38986,660,405248,121429,0,302,254,165,1,1,2023-05-22 11:51:46.000,2024-06-03 01:05:14.000
721,70014,36432,DRAW,to direct attention toward something,verb,(気を）引く,The city is full of landmarks that draw visitors from all over the world.,,111948,70014,29989,405245,320914,0,165,86,26,1,1,2023-05-22 11:51:46.000,2023-05-22 11:54:07.000
722,45630,22846,DEGREE,a unit to measure angles or temperatures,noun,(温度、経度・緯度など)度,The weather today was one degree hotter than yesterday.,,72335,45630,763,404495,289278,0,389,220,8,0,0,2023-05-22 11:51:46.000,2023-05-22 11:51:46.000
722,44180,22210,DEGREE,a qualification after finishing college,noun,学位,I graduated from university in 2010 with a degree in finance.,,69457,44180,763,404494,143936,0,389,119,124,0,0,2023-05-22 11:51:46.000,2023-05-22 11:51:46.000
723,70389,36635,TOPIC,a subject that you talk or write about,noun,話題,What was the topic of the message?,,112478,70389,1554,417572,43305,0,347,345,323,1,1,2023-05-22 11:51:46.000,2024-07-08 05:12:40.000
724,77799,41342,ALRIGHT,used to ask for or express agreement,interjection,大丈夫、問題ない,"Alright, see you later!",,122104,77799,7015,5306,148466,0,415,334,458,0,0,2023-05-22 11:51:46.000,2023-05-22 11:51:46.000
725,48840,24328,SNOW,ice that falls during winter,noun,雪,The snow was thick.,,78986,48840,563,416002,44460,0,456,339,415,1,1,2023-05-22 11:51:46.000,2024-06-06 13:44:57.000
726,71243,37120,LOCATION,a position or area,noun,位置、場所,"Yeah, the location is convenient.",,113806,71243,1470,409910,69731,0,643,313,304,1,1,2023-05-22 11:51:46.000,2024-07-02 15:02:06.000
727,29312,14260,GARDEN,an area of land where plants are grown,noun,庭,Vegetables grow in the garden.,,45009,29312,604,407216,54410,0,390,338,334,0,0,2023-05-22 11:51:46.000,2023-05-22 11:51:46.000
728,44580,22384,STORM,bad weather with strong winds,noun,嵐,A storm is coming.,,70228,44580,1256,172398,150713,0,414,350,287,1,1,2023-05-22 11:51:46.000,2023-05-22 11:54:02.000
729,17246,7497,SMILE,to show happiness on your face,verb,微笑む,We smile for the picture.,,28245,17246,474,415972,314064,0,349,196,90,0,1,2023-05-22 11:51:46.000,2023-05-22 11:54:09.000
729,60068,30436,SMILE,a facial expression that shows happiness,noun,笑顔,He's got a nice smile and is friendly.,,98321,60068,474,415971,118533,0,349,152,178,1,1,2023-05-22 11:51:46.000,2023-05-22 11:54:09.000
730,10061,4044,TREAT,to act toward someone in a particular way,verb,扱う、取り扱う,Airlines treat their frequent fliers very well.,,15767,10061,850,417756,312448,0,616,132,97,0,1,2023-05-22 11:51:46.000,2024-07-08 05:12:56.000
730,51606,25602,TREAT,delicious food that is not eaten often,noun,おやつ,You might find a tasty treat inside.,,84666,51606,850,186102,282837,0,616,90,84,0,1,2023-05-22 11:51:46.000,2023-05-22 11:54:03.000
730,9152,3618,TREAT,to give medical care,verb,治療する,It could tell the doctor how to treat the patient.,,14456,9152,850,417758,89778,0,616,103,55,0,1,2023-05-22 11:51:46.000,2024-05-21 10:27:29.000
731,19807,8934,SUCCESS,the desired result,noun,成功,﻿You cannot achieve success without failure.,,31872,19807,755,416661,317928,0,917,324,419,0,0,2023-05-22 11:51:46.000,2023-05-22 11:51:46.000
732,17582,7677,VEGETABLE,a plant that is eaten as food,noun,野菜,Do you think tomatoes are a fruit or a vegetable?,,28730,17582,528,418392,41995,0,355,327,73,0,0,2023-05-22 11:51:46.000,2023-05-22 11:51:46.000
733,20346,9236,ANCIENT,relating to the distant past,adjective,古代の,What you should not miss are the excavations of lost ancient cities.,,32595,20346,1527,400612,45375,0,355,331,422,1,1,2023-05-22 11:51:46.000,2024-07-02 15:01:59.000
734,73408,38407,PAGE,a sheet of paper in a book or magazine,noun,ページ,Kindly open your textbooks to page 16.,,116662,73408,714,412021,94195,0,210,135,433,1,1,2023-05-22 11:51:46.000,2024-07-07 18:30:41.000
735,47319,23638,COURT,a place for reviewing legal matters,noun,裁判所,The matter went to court.,,75754,47319,29787,403963,124867,0,343,333,336,0,0,2023-05-22 11:51:46.000,2023-05-22 11:51:46.000
736,49328,24566,SENSE,the ability to understand something,noun,感覚,When did you start to have this sense?,,79963,49328,240,415364,41701,0,446,238,384,1,1,2023-05-22 11:51:46.000,2024-06-18 07:58:26.000
736,44016,22118,SENSE,one of the five physical abilities,noun,感覚,Dogs have a sense of smell one thousand times more powerful than our own.,,69213,44016,240,415363,288637,0,446,77,26,0,0,2023-05-22 11:51:46.000,2023-05-22 11:51:46.000
737,51300,25480,AVOID,to stay away,verb,避ける,I'm staying in an airport hotel to avoid the traffic.,,84061,51300,823,401240,2735,0,434,314,353,0,0,2023-05-22 11:51:46.000,2023-05-22 11:51:46.000
738,46602,23303,EVERYWHERE,in or to every place,adverb,どこでも,There's water everywhere.,,74417,46602,29628,405959,43251,0,3158,310,423,0,0,2023-05-22 11:51:46.000,2023-05-22 11:51:46.000
739,43778,22007,APPEAR,to be in sight or to arrive,verb,現れる,Green leaves will appear everywhere.,,68784,43778,231,400759,124259,0,534,179,99,0,1,2023-05-22 11:51:46.000,2023-05-22 11:54:07.000
739,50045,24908,APPEAR,to seem to be a certain way,verb,に見える,...you realize that things aren't as rigid as they appear.,,81546,50045,231,400760,124247,0,534,139,50,0,0,2023-05-22 11:51:46.000,2023-05-22 11:51:46.000
740,17882,7807,PREFER,to like more than something else,verb,(～をより)好む,Can I call you Sarah or do you prefer Ms. Morrison?,,29184,17882,1223,413060,55866,0,393,329,323,1,1,2023-05-22 11:51:46.000,2023-05-22 11:54:08.000
741,47269,23620,PUSH,to move something forward or away,verb,押し動かす,I can push it...,,75653,47269,457,413597,330985,0,461,231,180,1,1,2023-05-22 11:51:46.000,2024-04-24 13:52:56.000
741,16326,7089,PUSH,to work hard to reach a goal,verb,強いてやり通す,Be willing to push yourself.,,26486,16326,457,140776,246713,0,461,104,60,0,1,2023-05-22 11:51:46.000,2023-05-22 11:53:58.000
742,3318,1430,PASSENGER,a person riding in a vehicle,noun,乗客,Are you traveling with this passenger?,,5930,3318,989,412208,301076,0,330,330,119,0,0,2023-05-22 11:51:46.000,2023-05-22 11:51:46.000
743,16300,7080,GOD,the creator and ruler of all things in some religions,noun,神,God speaks to me.,,26427,16300,2412,407405,60380,0,396,231,290,1,1,2023-05-22 11:51:46.000,2024-05-06 15:09:50.000
743,11206,4620,GOD,a being or force worshiped by people,noun,神,"Today, we'll be examining how a simple family doctor became the god of thunder.",,17637,11206,2412,407406,135817,0,396,108,32,0,0,2023-05-22 11:51:46.000,2023-05-22 11:51:46.000
744,68704,35676,DAMAGE,physical or mental harm,noun,被害、損傷,Another kind of hacker tries to do damage to a system.,,109953,68704,1412,404276,60166,0,385,186,222,1,1,2023-05-22 11:51:46.000,2023-05-22 11:54:07.000
744,49334,24569,DAMAGE,to harm someone or something,verb,傷つける,Bright computer screens can also damage parts inside eyes.,,79974,49334,1412,404275,293779,0,385,149,10,0,0,2023-05-22 11:51:46.000,2023-05-22 11:51:46.000
745,54092,27026,UNIT,a single product made by a company,noun,単位、単体,We inspect each unit before shipping them to stores.,,89075,54092,853,419898,331074,0,126,102,76,0,0,2023-05-22 11:51:46.000,2023-05-22 11:51:46.000
745,49855,24820,UNIT,a single thing from something larger,noun,一丸、チーム,They work together as a unit.,,81147,49855,36307,418128,124301,0,255,243,249,1,1,2023-05-22 11:51:46.000,2024-04-29 14:43:42.000
746,12072,5023,LOW,having a small amount or degree,adjective,少量の、低い,The boy is reported to have a low temperature but is conscious.,,19066,12072,207,410038,286594,0,415,314,371,0,0,2023-05-22 11:51:46.000,2023-05-22 11:51:46.000
747,47529,23741,PERFORM,to do something to entertain an audience,verb,演奏、演技する,"In some places, children still perform songs or riddles to get candy.",,76170,47529,846,412407,63464,0,742,161,96,0,1,2023-05-22 11:51:46.000,2023-05-22 11:54:08.000
747,3282,1422,PERFORM,to do something that needs skill,verb,実行する、果たす,Programmers can command a computer to perform tasks.,,5861,3282,846,412406,303660,0,742,152,108,0,1,2023-05-22 11:51:46.000,2024-07-03 23:35:45.000
748,51632,25617,RISK,a bad possibility,noun,危険,"...there are some ways to reduce your risk,...",,84707,51632,687,414737,50813,0,441,287,310,1,1,2023-05-22 11:51:46.000,2024-07-08 08:35:13.000
749,11793,4919,TOUCH,to put your hand on something,verb,さわる、触れる,Don't touch anything.,,18584,11793,974,184598,44076,0,497,319,320,1,1,2023-05-22 11:51:46.000,2024-06-24 08:52:04.000
750,51898,25742,FEAR,a feeling of being afraid,noun,恐怖,This fear is very common.,,85248,51898,865,406434,45646,0,489,331,339,0,0,2023-05-22 11:51:46.000,2023-05-22 11:51:46.000
751,47566,23754,ENTER,to take part in an activity or job,verb,入る,Are you going to enter the photo contest?,,76237,47566,715,405768,27413,0,376,74,25,0,0,2023-05-22 11:51:46.000,2023-05-22 11:51:46.000
751,45042,202483,ENTER,to come or go into something,verb,入る,Knock first before you enter.,,71169,45042,715,405769,69087,0,376,256,186,1,1,2023-05-22 11:51:46.000,2024-07-03 23:35:40.000
752,20018,9045,COMFORTABLE,confident and happy,adjective,快適な,Keep doing this until you're comfortable balancing on your bike.,,32161,20018,2257,403247,120099,0,551,171,234,0,0,2023-05-22 11:51:46.000,2023-05-22 11:51:46.000
752,20021,9046,COMFORTABLE,describes a good feeling and does not give pain ,adjective,心地よい,People wear them because they feel comfortable and relaxed in them.,,32166,20021,2257,403246,135624,0,551,152,166,0,0,2023-05-22 11:51:46.000,2023-05-22 11:51:46.000
753,12040,5013,STRIKE,a time when people protest by not working,noun,同盟して仕事を行わない事,The union members are on strike.,,19010,12040,29914,173205,106180,0,136,111,108,1,1,2023-05-22 11:51:46.000,2024-07-08 07:53:24.000
753,1816,853,STRIKE,to attack suddenly,verb,襲う,Israeli warplanes strike the Gaza area after rockets are fired into southern Israel.,,3065,1816,1264,173226,47691,0,292,37,24,0,1,2023-05-22 11:51:46.000,2023-05-22 11:54:02.000
753,40561,20319,STRIKE,the act of hitting something with force,noun,打撃,...once the president decided on a military strike...,,63160,40561,1264,173204,47684,0,292,46,41,0,1,2023-05-22 11:51:46.000,2024-05-03 09:39:19.000
753,9642,3876,STRIKE,a military attack,noun,軍事攻撃,The enemy began a strike near the military camp.,,15130,9642,1264,468753,400643,0,292,61,1,0,0,2023-05-22 11:51:46.000,2023-05-22 11:51:46.000
753,48069,23963,STRIKE,to hit forcefully,verb,ぶつかる,"...and then he would strike it,...",,77286,48069,1264,173223,21661,0,292,84,9,0,0,2023-05-22 11:51:46.000,2023-05-22 11:51:46.000
754,46736,23372,EMERGENCY,a situation that needs immediate action,noun,緊急事態,We have a medical emergency on board.,,74650,46736,1487,405634,332220,0,309,305,340,0,0,2023-05-22 11:51:46.000,2023-05-22 11:51:46.000
755,40576,20329,GIFT,something given to a person,noun,贈り物,It's the perfect gift!,,63193,40576,1104,407324,56071,0,386,329,287,1,1,2023-05-22 11:51:46.000,2024-06-11 04:13:10.000
756,42490,21297,EXPERT,a person who has special skill,noun,専門家,Focusing on problems turns you into an expert in what's wrong.,,66617,42490,821,406126,138889,0,321,300,140,0,0,2023-05-22 11:51:46.000,2024-06-24 13:50:16.000
757,2821,1259,TASK,a piece of work that must be done,noun,任務、課題、作業,One thing that stresses out a lot of people is the task of cleaning.,,4961,2821,899,417085,47276,0,350,311,220,1,1,2023-05-22 11:51:46.000,2023-05-22 11:54:09.000
758,16059,6980,BOSS,a person who tells others what to do,noun,上司、親方,My boss trusts me to do a good job.,,25941,16059,638,401918,124355,0,333,330,350,0,0,2023-05-22 11:51:46.000,2023-05-22 11:51:46.000
759,44777,22470,FREEDOM,the state of being liberated,noun,自由,It's your last chance at freedom.,,70629,44777,288,407054,123746,0,1232,323,385,0,0,2023-05-22 11:51:46.000,2023-05-22 11:51:46.000
760,42150,21145,FINANCIAL,related to money,adjective,財務の,Tie up any financial loose ends.,,65952,42150,1852,406571,65093,0,504,321,426,0,0,2023-05-22 11:51:46.000,2023-05-22 11:51:46.000
761,73493,38457,GOLD,a precious yellow metal,noun,金,Let's go and get the gold! Will you go with me?,,116776,73493,1021,407409,96212,0,505,231,332,1,1,2023-05-22 11:51:46.000,2024-05-13 05:53:38.000
761,36440,18067,GOLD,made of a precious yellow metal,adjective,金の,He or she receives a gold medal.,,56287,36440,1021,407410,314415,0,505,62,71,0,1,2023-05-22 11:51:46.000,2023-05-22 11:54:08.000
762,9026,3565,FOCUS,to give all your attention to something,adjective,集中する,She focuses on her work.,,14247,9026,705,406829,174156,0,383,203,1,0,0,2023-05-22 11:51:46.000,2023-05-22 11:51:46.000
762,15971,6942,FOCUS,the center of interest,noun,焦点,Change the focus and reword the answer to emphasize the positive.,,25775,15971,705,406822,98002,0,383,121,173,1,1,2023-05-22 11:51:46.000,2024-05-28 14:12:39.000
763,100485,56394,RICE,small grains that are cooked and eaten,noun,米,I see some chicken and rice.,,152805,100485,1067,414656,39742,0,316,296,392,1,1,2023-05-22 11:51:46.000,2024-07-05 15:31:18.000
764,46493,23238,BREAD,baked food made of of flour and water,noun,パン,Put some butter on the bread.,,74199,46493,517,402039,108481,0,296,291,412,1,1,2023-05-22 11:51:46.000,2024-07-01 22:53:55.000
765,25164,12050,PAINT,to cover something with color,verb,塗る,I paint the door purple.,,38966,25164,1212,412033,357148,0,644,174,85,0,0,2023-05-22 11:51:46.000,2023-05-22 11:51:46.000
765,40318,20192,PAINT,a colored liquid,noun,ペンキ,"Oh no, he got wet paint on his shirt.",,62759,40318,1212,412030,99202,0,644,143,158,1,1,2023-05-22 11:51:46.000,2024-06-14 14:26:51.000
766,43861,22042,MISTAKE,something that is wrong,noun,間違い,I made a mistake.,,68916,43861,613,410696,40522,0,371,324,184,0,0,2023-05-22 11:51:46.000,2023-05-22 11:51:46.000
767,45488,22792,STYLE,the way that something is made or done,noun,様式,"Well, I think that style will look really good on you.",,72077,45488,854,173950,78512,0,467,309,347,1,1,2023-05-22 11:51:46.000,2024-07-05 15:31:35.000
768,48421,24131,ROCK,a large stone,noun,岩,"It looks like a mountain, but it is actually a very big rock.",,78000,48421,806,414771,2184,0,337,315,270,0,0,2023-05-22 11:51:46.000,2023-05-22 11:51:46.000
769,49782,24791,MODERN,belonging to the present time,adjective,近代的な,Panama City really is the most modern capital in all of Central America.,,80965,49782,898,410748,110191,0,358,305,412,0,0,2023-05-22 11:51:46.000,2023-05-22 11:51:46.000
770,14932,6464,BEAR,"a big, furry animal with sharp claws",noun,熊,The bear is brown.,,24034,14932,29868,401512,194870,0,352,350,316,0,0,2023-05-22 11:51:46.000,2023-05-22 11:51:46.000
771,48329,24087,CAKE,a sweet baked food,noun,ケーキ,She took a bite of cake and relaxed.,,77807,48329,426,402353,302527,0,326,301,304,0,0,2023-05-22 11:51:46.000,2023-05-22 11:51:46.000
772,52205,25875,POLITICAL,relating to matters of government,adjective,政治的な,There are two political parties in the U.S.,,85912,52205,16040,412824,129523,0,585,322,384,0,0,2023-05-22 11:51:46.000,2023-05-22 11:51:46.000
773,46484,23233,ATTENTION,the interest given to something,noun,静聴、視聴,Thank you for your attention.,,74180,46484,659,401139,69488,0,349,324,423,0,0,2023-05-22 11:51:46.000,2023-05-22 11:51:46.000
774,45108,22631,MARCH,to walk as a group to express an opinion,verb,行進する,We must march!,,71303,45108,1699,410249,313215,0,425,92,53,0,1,2023-05-22 11:51:46.000,2023-05-22 11:54:08.000
774,38906,19427,MARCH,the third month of the year,noun,"3月",I started applying for jobs last January and was hired in March.,,60472,38906,1699,232051,66882,0,425,230,285,1,1,2023-05-22 11:51:46.000,2024-06-11 13:42:04.000
775,36197,17947,PROFESSIONAL,someone who does a job requiring special training,noun,専門職,"...coach, finder of lost articles, psychologist, substitute parent, sales professional...",,55871,36197,1134,413310,99843,0,417,74,17,0,0,2023-05-22 11:51:46.000,2023-05-22 11:51:46.000
775,17136,7433,PROFESSIONAL,done in a skillful or careful way,adjective,専門的な,She is our newest certified natural health professional graduate.,,28062,17136,1134,413314,48798,0,417,167,230,1,1,2023-05-22 11:51:46.000,2023-05-22 11:54:08.000
775,17138,7434,PROFESSIONAL,of a job that requires special training,adjective,プロの、専門職の,Is she a professional musician?,,28066,17138,1134,413312,324537,0,417,72,78,0,1,2023-05-22 11:51:46.000,2023-05-22 11:54:08.000
776,52017,25790,GIANT,very large,adjective,巨大な,A king wears a giant crown.,,85513,52017,2076,407323,67056,0,346,250,316,1,1,2023-05-22 11:51:46.000,2024-07-05 06:20:46.000
776,12784,5342,GIANT,a large or powerful thing,noun,巨人,The tech giant takes the crown for best company for compensation and benefits.,,20509,12784,2076,407322,99734,0,346,64,69,0,1,2023-05-22 11:51:46.000,2024-06-25 14:54:59.000
777,42161,21148,GENERATION,age group,noun,世代,It's about inspiring this generation...,,65979,42161,888,407266,315196,0,375,295,261,0,0,2023-05-22 11:51:46.000,2023-05-22 11:51:46.000
778,1071,521,LIE,to be in a flat position,verb,横たわる,Please lie on your back.,,1619,1071,738,409740,25880,0,211,93,19,0,0,2023-05-22 11:51:46.000,2023-05-22 11:51:46.000
778,71597,37336,LIE,to exist or to be found somewhere,verb,次第である,But her true interests lie elsewhere.,,114245,71597,738,101743,197665,0,211,77,9,0,0,2023-05-22 11:51:46.000,2023-05-22 11:51:46.000
778,26848,12936,LIE,to say something which is not true,verb,うそをつく,It is very bad to lie.,,41338,26848,29753,409738,326973,0,218,153,89,1,1,2023-05-22 11:51:46.000,2024-06-26 06:35:23.000
779,47208,23598,NORMAL,usual or ordinary,adjective,標準の、ふつうの,Maybe I should go to the grocery store like a normal person..,,75527,47208,1293,411289,94989,0,477,310,391,1,1,2023-05-22 11:51:46.000,2024-05-08 14:32:19.000
780,45119,22634,SOLVE,to answer or deal with a problem,verb,解決する,People don't expect government to solve all their problems.,,71328,45119,1248,416084,49982,0,313,311,269,0,0,2023-05-22 11:51:46.000,2023-05-22 11:51:46.000
