"rank","id","sharedMeaningId","label","definition","POS","japaneseTranslation","canonicalLine","dialogLineId","id","wordId","wordHeadId","wordRootId","wordInstanceId","wordUsageCount","headUsageCount","rootUsageCount","instanceUsageCount","headPick","rootPick","created","modified"
1964,47107,23552,BARRIER,a problem,noun,障害,Jargon is a barrier to our understanding of your ideas.,,75331,47107,2105,401430,14319,0,78,44,28,0,0,2023-05-22 11:51:46.000,2023-05-22 11:51:46.000
1964,51398,25518,BARRIER,something that physically blocks movement from one point to another,noun,障害物,A layer of cells called a blood brain barrier protects the brain from infection.,,84264,51398,2105,401431,318668,0,78,34,26,0,1,2023-05-22 11:51:46.000,2023-05-22 11:54:19.000
1965,94814,52459,SIGHT,the things or people that one sees,noun,光景,It's an amazing sight.,,144794,94814,1448,415700,89620,0,140,73,80,1,1,2023-05-22 11:51:46.000,2024-07-02 15:02:08.000
1966,48770,24295,CONTROVERSIAL,causing argument and discussion,adjective,論議を呼ぶ,This was a controversial topic at that time.,,78808,48770,2534,403758,125253,0,112,78,91,0,0,2023-05-22 11:51:46.000,2023-05-22 11:51:46.000
1967,72718,37996,BARELY,in a way that is difficult but still possible,adverb,むき出しの、最低限の,"Yet, he barely made it to the NFL at all.",,115745,72718,2715,401407,5150,0,113,55,71,0,0,2023-05-22 11:51:46.000,2023-05-22 11:51:46.000
1967,12855,5381,BARELY,almost not at all,adverb,辛うじて,"Yeah, we barely made it, but we did make it.",,20623,12855,2715,401406,341631,0,113,25,26,0,1,2023-05-22 11:51:46.000,2023-05-22 11:54:07.000
1968,44373,22297,YOUTH,people between childhood and adulthood,noun,若者,He is working with the mayor's office to teach inner city youth how to appreciate and care for their environment.,,69818,44373,1366,420072,64580,0,112,77,98,1,1,2023-05-22 11:51:46.000,2023-05-22 11:54:10.000
1969,71193,37080,REMARKABLE,interesting and worthy of notice,adjective,注目すべき,And that's remarkable because you and I can't do that.,,113736,71193,2447,414277,286101,0,133,75,100,0,0,2023-05-22 11:51:46.000,2023-05-22 11:51:46.000
1970,73818,38658,STRICT,obeying a command or rule completely,adjective,厳しい、厳格な,They exercise strict control over us.,,117238,73818,1652,173164,42218,0,120,76,83,1,1,2023-05-22 11:51:46.000,2023-05-22 11:54:02.000
1971,45516,22803,POSE,the way a person sits or stands,noun,姿勢,"Everyone has their signature look, what would you say your signature pose is?",,72125,45516,1952,412911,291161,0,98,30,24,0,1,2023-05-22 11:51:46.000,2023-05-22 11:54:08.000
1971,41951,21045,POSE,to cause a difficulty or problem,verb,及ぼす、もたらす,Does that pose a threat to our national security?,,65532,41951,1952,412914,314835,0,98,46,25,1,1,2023-05-22 11:51:46.000,2023-05-22 11:54:08.000
1972,41974,21055,MAINTENANCE,the act of keeping in good condition,noun,整備、維持,Tooth maintenance is extremely important for both people and animals.,,65581,41974,829,410147,137418,0,340,80,94,0,1,2023-05-22 11:51:46.000,2023-05-22 11:54:08.000
1973,73840,38669,BRIEF,to give information to someone,verb,要約する,Will you brief me on the meeting beforehand?,,117272,73840,1926,22553,151549,0,142,20,3,0,0,2023-05-22 11:51:46.000,2023-05-22 11:51:46.000
1973,41646,20893,BRIEF,short,adjective,短い,The frog dove for a brief moment and got the sculpture.,,64958,41646,1926,402105,112329,0,142,31,39,0,1,2023-05-22 11:51:46.000,2024-05-17 06:45:22.000
1973,101109,56860,BRIEF,using very few words,adjective,簡潔な,One way to do that: be brief.,,153692,101109,1926,402107,55029,0,142,27,39,0,1,2023-05-22 11:51:46.000,2023-05-22 11:54:07.000
1974,8002,3084,WRAP,to cover something with paper or cloth,verb,包む,They wrap the gifts with pretty paper.,,12685,8002,1907,419087,309260,0,115,81,49,1,1,2023-05-22 11:51:46.000,2023-05-22 11:54:09.000
1975,27201,13111,FIFTY,"50",adjective,五十,Fifty people worked to make this cake.,,41866,27201,38420,406517,288870,0,78,78,69,0,0,2023-05-22 11:51:46.000,2023-05-22 11:51:46.000
1976,62462,31810,CRITIC,a person who judges for quality,noun,評論家,I'm like my harshest critic.,,101617,62462,1346,404102,127349,0,245,74,13,0,0,2023-05-22 11:51:46.000,2023-05-22 11:51:46.000
1977,32834,16197,ALCOHOL,something that makes people drunk,noun,酒、酒精飲料,Did you drink any alcohol?,,50215,32834,1709,400451,27919,0,97,78,102,1,1,2023-05-22 11:51:46.000,2023-05-22 11:54:07.000
1978,12892,5396,INTERACTION,the act of being with other people,noun,交流,There's more interaction.,,20699,12892,3101,314458,149289,0,267,73,88,1,1,2023-05-22 11:51:46.000,2024-05-10 14:19:09.000
1979,29912,14614,RANK,to have or give a position based on importance,verb,階級付けする,They rank below all commissioned officers.,,45835,29912,2125,413818,61613,0,102,46,22,0,1,2023-05-22 11:51:46.000,2024-05-13 05:53:34.000
1979,94197,52019,RANK,"a position in a society, organization, or group",noun,階級,Enlisted soldiers begin with the rank of private.,,143871,94197,2125,413810,255793,0,102,27,15,0,1,2023-05-22 11:51:46.000,2023-05-22 11:54:09.000
1980,9760,3905,CONVERT,to switch from one state to another,verb,変換、変える,It is easy to convert a percentage to a fraction.,,15325,9760,2538,403780,95221,0,92,71,37,0,0,2023-05-22 11:51:46.000,2023-05-22 11:51:46.000
1981,17140,7435,STATISTIC,a number that provides information,noun,統計,"In late 2017, Netflix themselves released a surprising statistic...",,28072,17140,4868,416540,182115,0,129,82,13,0,0,2023-05-22 11:51:46.000,2023-05-22 11:51:46.000
1982,41924,21037,ARCHITECTURE,a method or style of building,noun,建築,Gothic architecture is characterized by pointed arches.,,65491,41924,2401,400864,309139,0,102,69,105,1,1,2023-05-22 11:51:46.000,2024-05-15 14:44:39.000
1983,46228,23110,FLEXIBLE,able to adjust easily,adjective,柔軟性のある,"If your schedule's too tight, it's not flexible.",,73614,46228,3047,406720,102727,0,135,75,95,1,1,2023-05-22 11:51:46.000,2024-06-21 13:51:18.000
1984,35862,17795,AWFUL,very bad,adjective,酷く落ち込む、気分が悪い,And I felt awful and I thought I was gonna lose my job.,,55341,35862,1672,401262,57367,0,92,78,96,1,1,2023-05-22 11:51:46.000,2024-06-03 08:22:14.000
1985,45450,22776,FILTER,a device that removes unwanted things,noun,ろ過器,Our brains have a filter that purges information they consider unimportant.,,72010,45450,3112,406557,297782,0,105,36,21,1,1,2023-05-22 11:51:46.000,2023-05-22 11:54:08.000
1985,23470,11122,FILTER,to remove unwanted parts,verb,濾過する 濾過して取り除く,"Lastly, filter it through a cheesecloth-lined strainer.",,36625,23470,3112,406556,206117,0,105,41,28,0,1,2023-05-22 11:51:46.000,2023-05-22 11:54:08.000
1986,36502,18101,RARELY,almost never,adverb,めったに,He is rarely late for school.,,56395,36502,29734,413831,137684,0,234,78,89,0,1,2023-05-22 11:51:46.000,2023-05-22 11:54:09.000
1987,35162,17441,MODE,a way of operating something,noun,方法,"So, this is a whole new mode of production that's emerging.",,54109,35162,2187,410727,34438,0,77,49,68,1,1,2023-05-22 11:51:46.000,2023-05-22 11:54:08.000
1987,100445,56367,MODE,a way of acting or doing something,noun,状態、方法、様式,"Authorities still in search and rescue mode,...",,152712,100445,2187,410726,132421,0,77,28,19,0,1,2023-05-22 11:51:46.000,2023-05-22 11:54:08.000
1988,46656,23333,OBJECTIVE,purpose or goal to be achieved,noun,目標,I understand that you think the objective is too challenging.,,74500,46656,2024,411456,84529,0,85,76,59,1,1,2023-05-22 11:51:46.000,2024-05-20 12:28:39.000
1989,72608,37944,PAUSE,a short stop,noun,(一時的な)中止,The comma adds a pause in a sentence.,,115581,72608,1688,412282,313295,0,80,26,27,0,1,2023-05-22 11:51:46.000,2023-05-22 11:54:08.000
1989,26870,12943,PAUSE,to stop for a short time,verb,休止する,"Remember, it's okay to pause when you speak.",,41393,26870,1688,412283,295148,0,80,48,39,1,1,2023-05-22 11:51:46.000,2023-05-22 11:54:08.000
1990,50979,25344,ABUSE,improper or unfair treatment,noun,乱用、悪用,...and are still victims of violence and abuse.,,83405,50979,1416,400070,112550,0,141,79,58,1,1,2023-05-22 11:51:46.000,2023-05-22 11:54:07.000
1991,47354,23651,CONSTANT,happening without pause,adjective,絶え間ない,"So I was living in constant fear that my identity could be revealed,...",,75819,47354,2013,403612,63526,0,251,77,102,0,1,2023-05-22 11:51:46.000,2023-05-22 11:54:07.000
1992,37549,18656,JAIL,a prison,noun,刑務所,"You have to catch it and if you don't catch it, you have to go in the jail.",,58201,37549,2072,409171,125783,0,108,79,92,0,0,2023-05-22 11:51:46.000,2023-05-22 11:51:46.000
1993,36746,18238,APPROXIMATELY,in a way that is not exact,adverb,およそ,"LDLC employs approximately 1,000 people.",,56813,36746,3780,400826,307432,0,87,76,93,1,1,2023-05-22 11:51:46.000,2024-07-04 01:16:09.000
1994,47435,23698,GRAIN,seeds used for food,noun,穀粒、全粒,"So, we instantly had to start testing every single lot of grain that we bought...",,76004,47435,2444,407469,291608,0,80,71,59,1,1,2023-05-22 11:51:46.000,2024-07-04 01:15:56.000
1995,47451,23705,REGULARLY,often or frequently,adverb,定期的に、 たびたび,Ken orders a bottle of soda regularly.,,76029,47451,1354,414173,312371,0,361,71,90,0,1,2023-05-22 11:51:46.000,2024-07-01 12:57:23.000
1996,99054,55356,DESTRUCTION,the process of damaging something badly,noun,破壊,"Destruction of rainforests results in more pollution, less rain, and less oxygen for the world.",,150731,99054,51561,404670,61059,0,110,78,95,1,1,2023-05-22 11:51:46.000,2023-05-22 11:54:07.000
1997,35816,17768,COMEDY,"a funny movie, play or TV program, etc.",noun,喜劇,I watched a romantic comedy movie.,,55261,35816,2636,403240,148065,0,105,76,79,0,0,2023-05-22 11:51:46.000,2023-05-22 11:51:46.000
1998,42056,21104,ACCURATE,exact and correct,adjective,正確な,"However, it is not accurate.",,65740,42056,2160,400129,133991,0,118,71,94,1,1,2023-05-22 11:51:46.000,2024-06-18 05:18:19.000
1999,29203,14216,EFFECTIVELY,in a way that produces the wanted result,adverb,効果的に,...here are some ideas to effectively manage your time.,,44805,29203,951,405501,62244,0,347,72,101,0,0,2023-05-22 11:51:46.000,2023-05-22 11:51:46.000
2000,37258,18504,INTERNAL,happening inside a country or organization,adjective,国内の,But within the internal communications it's really split.,,57664,37258,1489,408966,296124,0,89,27,30,0,1,2023-05-22 11:51:46.000,2024-05-06 15:25:31.000
2000,97769,54482,INTERNAL,being or happening inside of something,adjective,内部の,"These keep internal temperatures at a safe, low level.",,148917,97769,1489,408967,307807,0,89,46,73,0,0,2023-05-22 11:51:46.000,2023-05-22 11:51:46.000
2001,50735,25224,BOND,a strong emotional connection between people,noun,絆,And family is the tightest bond of all.,,82919,50735,1563,401874,310505,0,180,48,43,0,1,2023-05-22 11:51:46.000,2023-05-22 11:54:07.000
2001,32392,15945,BOND,to develop a close relationship with someone,verb,絆を結ぶ,...and it's very special how much you bond with people.,,49588,32392,1563,401871,110775,0,180,28,17,0,1,2023-05-22 11:51:46.000,2023-05-22 11:54:07.000
2002,12904,5402,SELF,a person's own nature or qualities,noun,自身、自分,I will show my changing self to you in your days ahead.,,20717,12904,1930,415331,210351,0,129,75,104,1,1,2023-05-22 11:51:46.000,2024-06-14 14:26:54.000
2003,36560,18131,ILLNESS,the state of being sick,noun,病気,He is staying in the hospital because of his illness.,,56496,36560,487,408416,61948,0,141,79,65,1,1,2023-05-22 11:51:46.000,2023-05-22 11:54:08.000
2004,46629,23317,TWIN,"referring to two similar or related people, things, or events",adjective,対の、よく似た,"So, we have twin pillars: economic and intellectual.",,74461,46629,1819,417937,308110,0,86,34,43,0,1,2023-05-22 11:51:46.000,2023-05-22 11:54:09.000
2004,34399,17079,TWIN,one of two babies born to the same mother at the same time,noun,双子,Let's just hope you don't have an evil twin that wants to borrow your car.,,52675,34399,1819,417934,303661,0,86,42,4,0,0,2023-05-22 11:51:46.000,2023-05-22 11:51:46.000
2005,38431,19176,SOLID,being firm or hard,adjective,固体の,Some materials that are solid become like air when they are super small.,,59562,38431,1620,419559,149998,0,113,37,55,1,1,2023-05-22 11:51:46.000,2023-05-22 11:54:09.000
2005,34871,17289,SOLID,strong,adjective,信頼できる,We give the Ove Glove a solid thumbs-up!,,53549,34871,1620,416071,305763,0,113,38,42,0,0,2023-05-22 11:51:46.000,2023-05-22 11:51:46.000
2006,47373,23664,VITAL,extremely important,adjective,不可欠な、重要な,"First of all, they provide vital ecological services.",,75864,47373,2545,418535,56272,0,75,69,95,1,1,2023-05-22 11:51:46.000,2024-06-14 14:22:18.000
2007,14714,6352,STAIR,steps to go up and down,noun,階段,The family sat on the top stair to take a picture.,,23702,14714,7827,416435,312144,0,122,75,1,0,0,2023-05-22 11:51:46.000,2023-05-22 11:51:46.000
2008,3532,1527,MAXIMUM,greatest possible in degree or amount,adjective,最大限の,It takes about ten minutes maximum to ride two miles.,,6253,3532,2381,410398,131604,0,123,76,78,1,1,2023-05-22 11:51:46.000,2024-04-26 14:52:37.000
2009,16286,7076,RELATIVE,a member of one's family,noun,親戚,Who is a relative you often see?,,26398,16286,973,414218,314240,0,99,78,13,0,0,2023-05-22 11:51:46.000,2023-05-22 11:51:46.000
2010,10627,4338,RECOVERY,the act of returning to a normal state,noun,回復,An economic recovery has begun.,,16696,10627,1920,414042,84069,0,216,76,92,0,0,2023-05-22 11:51:46.000,2023-05-22 11:51:46.000
2011,16264,7069,ADMIT,to agree that something is true,verb,認める,"I must admit, I used to be one of them.",,26342,16264,923,400267,78689,0,102,73,79,1,1,2023-05-22 11:51:46.000,2024-05-01 09:33:27.000
2012,30011,14666,RECALL,to ask or order someone to return,verb,リコールする,Anyone can recall a book whenever they want.,,45979,30011,948,413965,304953,0,101,13,4,0,0,2023-05-22 11:51:46.000,2023-05-22 11:51:46.000
2012,47291,23626,RECALL,to remember something,verb,思い出す,You may recall we went through a park in Botswana.,,75708,47291,948,413964,89244,0,101,66,58,1,1,2023-05-22 11:51:46.000,2024-06-14 14:22:22.000
2013,51738,25669,GREET,to welcome somebody when you meet ,verb,挨拶する,You greet your loved ones.,,84944,51738,977,79195,47596,0,140,74,42,0,1,2023-05-22 11:51:46.000,2023-05-22 11:54:19.000
2014,37214,18485,VOLUME,the strength or degree of sound,noun,音量,"If you're on the telephone, you really should keep your volume down,...",,57591,37214,1576,418563,76187,0,86,21,22,0,1,2023-05-22 11:51:46.000,2023-05-22 11:54:09.000
2014,51187,25439,VOLUME,an amount of something,noun,(本の)巻、量,And it represents the largest volume of fresh water in the British Isles.,,83783,51187,1576,418564,304391,0,86,54,64,1,1,2023-05-22 11:51:46.000,2023-05-22 11:54:09.000
2015,37423,18600,SKIRT,clothing that hangs from the waist,noun,スカート,I want to buy this pretty skirt.,,57960,37423,590,162884,260765,0,76,74,75,1,1,2023-05-22 11:51:46.000,2024-06-12 10:51:42.000
2016,29035,14115,AGENT,someone who gets secret information about another country,noun,諜報員,I am a secret agent.,,44564,29035,884,458748,384537,0,95,16,11,0,1,2023-05-22 11:51:46.000,2023-05-22 11:54:16.000
2016,20589,9379,AGENT,a person who does business for another person,noun,代理人,In Florida we're required to be a sales agent for a couple of years...,,32923,20589,884,400377,124475,0,95,57,61,1,1,2023-05-22 11:51:46.000,2024-05-09 15:05:37.000
2017,1341,671,PRETEND,to act as if it is true when it is not,verb,ふりをする,"Pretend it's an island, out in the ocean.",,2118,1341,1883,419250,129753,0,83,73,58,1,1,2023-05-22 11:51:46.000,2023-05-22 11:54:09.000
2018,41798,20964,FAIRLY,somewhat or to some degree,adverb,まあまあ、かなり,We work on those fairly often.,,65256,41798,36218,406298,54252,0,72,72,87,0,0,2023-05-22 11:51:46.000,2023-05-22 11:51:46.000
2019,24630,11758,CONCLUDE,to form an opinion,verb,結論する,"Well, you have to conclude that we wanted to do it.",,38267,24630,1466,403462,128610,0,74,40,18,0,0,2023-05-22 11:51:46.000,2023-05-22 11:51:46.000
2019,39027,19492,CONCLUDE,to finish,verb,終える、締めくくる,"Lastly, I want to conclude by thanking all who attended tonight's event.",,60660,39027,1466,403463,322509,0,74,34,12,0,0,2023-05-22 11:51:46.000,2023-05-22 11:51:46.000
2020,70810,36874,IMMIGRATION,the act going to another country to live,noun,移住,"Yes, here's my passport and immigration form.",,113134,70810,7790,408455,311058,0,81,74,84,1,1,2023-05-22 11:51:46.000,2024-05-13 05:53:41.000
2021,12994,5444,PERFECTLY,without mistakes or flaws,adverb,完璧に,The production was perfectly consistent.,,20929,12994,969,412403,307107,0,799,71,100,0,0,2023-05-22 11:51:46.000,2023-05-22 11:51:46.000
2022,47814,23851,OPERATOR,"a person or organization who controls a machine, device or business",noun,操縦者,The system is controlled by an operator.,,76727,47814,1327,316624,284448,0,661,69,43,0,0,2023-05-22 11:51:46.000,2023-05-22 11:51:46.000
2023,21990,10280,COMFORT,being relaxed and happy,noun,快適さ、安心感,And we want the logo to represent comfort.,,34692,21990,2257,403242,80657,0,551,69,90,0,0,2023-05-22 11:51:46.000,2023-05-22 11:51:46.000
2024,101144,56888,COMMAND,the power to control the actions of others,noun,指揮命令権,You are to take immediate command of his military guard.,,153757,101144,1820,403258,104545,0,170,28,36,0,1,2023-05-22 11:51:46.000,2023-05-22 11:54:07.000
2024,35456,17588,COMMAND,an order that instructs a person or animal to do something,noun,命令,"Turn left and right, move forward and stop on command.",,54646,35456,1820,403257,294795,0,170,23,14,0,0,2023-05-22 11:51:46.000,2023-05-22 11:51:46.000
2024,35459,17590,COMMAND,an order that is given to a computer,noun,制御,You've got some basic commands on your touchpad here.,,54650,35459,1820,403259,296567,0,170,26,4,0,0,2023-05-22 11:51:46.000,2023-05-22 11:51:46.000
2025,37404,18587,ARRIVAL,the act of coming to or reaching a place,noun,到着,Does she need assistance upon arrival?,,57927,37404,549,400943,328209,0,684,74,88,0,1,2023-05-22 11:51:46.000,2024-06-07 14:31:09.000
2026,59976,30380,ANXIETY,a feeling of worry or distress about the future,noun,心配、不安,I thought it was from the stress and anxiety I'm feeling.,,98159,59976,2046,400710,116977,0,64,63,94,1,1,2023-05-22 11:51:46.000,2024-04-29 14:31:40.000
2027,50497,25109,CLOSELY,in a nearby or connected manner,adverb,密接に,We're working with you very closely...,,82498,50497,29858,403060,323678,0,744,70,93,0,1,2023-05-22 11:51:46.000,2024-05-29 12:49:20.000
2028,30969,15186,LENGTH,the distance from one end to the other,noun,長さ,I've got shoulder length hair.,,47326,30969,1550,409666,298325,0,114,72,86,1,1,2023-05-22 11:51:46.000,2023-05-22 11:54:08.000
2029,98848,55221,CHEST,the upper front part of the body,noun,胸,I have a slight pain in my chest.,,150457,98848,1046,402805,109565,0,76,76,90,1,1,2023-05-22 11:51:46.000,2023-05-22 11:54:07.000
2030,42092,21120,COOPERATION,working together,noun,協力,Thank you for your cooperation.,,65809,42092,2392,403808,50523,0,127,70,83,1,1,2023-05-22 11:51:46.000,2023-05-22 11:54:07.000
2031,46096,23043,PEAK,to reach the highest or best point,verb,頂点に達する,"Peak to 4,000 a month?",,73330,46096,2005,412314,299303,0,101,15,7,0,1,2023-05-22 11:51:46.000,2023-05-22 11:54:08.000
2031,34661,17199,PEAK,the top of a tall mountain,noun,頂上,"When he reached the peak, he met a fox.",,53158,34661,2005,412315,116692,0,101,23,25,0,1,2023-05-22 11:51:46.000,2023-05-22 11:54:08.000
2031,28580,13863,PEAK,the highest level or degree of something,noun,最高点,"I am at the peak of my abilities, and I want to keep going.",,43830,28580,2005,412312,2283,0,101,33,45,0,0,2023-05-22 11:51:46.000,2023-05-22 11:51:46.000
2032,41879,21011,INSIGHT,the ability to understand things in a clear way,noun,洞察,Hong managed to smuggle photos out of the country that gives an insight into life there.,,65394,41879,2525,408833,127411,0,68,66,41,0,0,2023-05-22 11:51:46.000,2024-05-01 08:23:23.000
2033,38430,19175,ELDERLY,people who are old,noun,お年寄り,Officials express concern for the elderly.,,59561,38430,1657,57829,244079,0,110,41,48,1,1,2023-05-22 11:51:46.000,2023-05-22 11:53:47.000
2033,44620,22401,ELDERLY,very old,adjective,年寄りの,Oliver saw an elderly gentleman standing outside the bookshop.,,70306,44620,1657,405543,285949,0,110,31,33,0,1,2023-05-22 11:51:46.000,2023-05-22 11:54:07.000
2034,45321,22718,UNIVERSAL,involving or affecting everyone in the world,adjective,普遍的な,The world has other universal languages.,,71768,45321,1916,418135,5356,0,224,56,97,0,1,2023-05-22 11:51:46.000,2024-05-24 08:50:00.000
2035,69463,36115,ANGER,a strong feeling of being upset,noun,怒り,I go back and forth between happiness and anger.,,111149,69463,1808,400623,71699,0,101,73,80,1,1,2023-05-22 11:51:46.000,2023-05-22 11:54:07.000
2036,51558,25580,MEDIUM,something between small and large in size,noun,エムサイズ,You might have a medium in the stock room.,,84556,51558,2456,410464,318742,0,41,11,11,0,1,2023-05-22 11:51:46.000,2023-05-22 11:54:08.000
2036,99222,55485,MEDIUM,a particular form of communication,noun,媒介,Presentations are a powerful communication medium.,,150952,99222,742,410467,323812,0,311,30,15,0,1,2023-05-22 11:51:46.000,2024-05-03 09:39:33.000
2036,38653,19281,MEDIUM,being in the middle,adjective,中間の,"We have small, medium  and large sizes.",,60026,38653,2456,410466,315002,0,41,30,43,1,1,2023-05-22 11:51:46.000,2024-06-13 13:29:20.000
2037,30073,14697,PIPE,tube where gases and liquids flow,noun,管,The plumber is fixing the broken pipe.,,46049,30073,1243,412610,259803,0,82,74,43,0,0,2023-05-22 11:51:46.000,2023-05-22 11:51:46.000
2038,48195,24019,ENTRANCE,an opening that is used to enter a place,noun,入り口,We have to take off our shoes at the entrance.,,77559,48195,996,405790,48459,0,82,70,95,1,1,2023-05-22 11:51:46.000,2024-05-10 14:15:30.000
2039,45056,22607,WOODEN,made from the material of trees,adjective,木製の,"Finally, they dug out a wooden box.",,71203,45056,409,419020,289107,0,312,72,86,0,1,2023-05-22 11:51:46.000,2024-05-01 08:19:24.000
2040,101996,57556,RAW,not cooked,adjective,生の,Eat a raw onion.,,154911,101996,2182,413862,83751,0,67,45,80,1,1,2023-05-22 11:51:46.000,2024-07-07 22:55:30.000
2040,13221,5551,RAW,being in a natural or unchanged state,adjective,未加工の,These raw materials go through a transformation during the production processes.,,21352,13221,2182,413863,126782,0,67,16,22,0,1,2023-05-22 11:51:46.000,2023-05-22 11:54:09.000
2041,19351,8647,GEAR,things needed for a special purpose,noun,道具、索具,"If you don't have any gear, don't worry.",,31218,19351,2104,407243,46115,0,90,53,71,1,1,2023-05-22 11:51:46.000,2024-06-04 13:07:38.000
2041,68302,35451,GEAR,to make something suitable,verb,適合させる。,The newest luxury item geared towards kitties is wine.,,109306,68302,2104,428931,333859,0,90,16,1,0,0,2023-05-22 11:51:46.000,2023-05-22 11:51:46.000
2042,34009,16876,IRON,a type of metal that is used to make steel,noun,鉄,Train tracks are made of iron.,,52008,34009,1758,409111,96110,0,67,18,30,0,1,2023-05-22 11:51:46.000,2024-06-19 17:08:10.000
2042,48355,24099,IRON,made of a common type of metal,adjective,鉄,Stir it up and put it on the iron plate.,,77860,48355,1758,409115,284811,0,67,43,57,1,1,2023-05-22 11:51:46.000,2024-06-19 14:59:34.000
2043,41138,20640,COUGH,"the act of forcing air through the throat with a short, loud noise",noun,咳,"I have a fever, cough and sneeze.",,64125,41138,1150,403909,323043,0,75,32,38,1,1,2023-05-22 11:51:46.000,2024-06-18 00:56:07.000
2043,39121,19531,COUGH,to force air through your throat,verb,咳をする,Cough or sneeze into your elbow.,,60827,39121,1150,403911,320142,0,75,39,15,0,0,2023-05-22 11:51:46.000,2023-05-22 11:51:46.000
2044,40704,20399,ROUGH,having an uneven surface,adjective,荒れた、荒い,"Zebras, buffaloes and elephants are easily viewed from the rough dirt road.",,63420,40704,1002,414851,109663,0,171,33,52,0,1,2023-05-22 11:51:46.000,2023-05-22 11:54:09.000
2044,34249,16996,ROUGH,difficult and full of problems,adjective,辛い、苦しい,"Wow, looks like they had a rough week.",,52397,34249,1002,419374,70953,0,171,26,29,0,1,2023-05-22 11:51:46.000,2023-05-22 11:54:09.000
2044,34251,16997,ROUGH,involving sudden and violent movements,adjective,粗暴な,"Whoa, that was rough.",,52402,34251,1002,414852,149419,0,171,13,14,0,1,2023-05-22 11:51:46.000,2023-05-22 11:54:09.000
2045,43343,21757,EXCUSE,a reason for a mistake or bad behavior,noun,言い訳,Her excuse is that her dog ate her homework.,,68046,43343,1031,406036,73173,0,95,74,74,1,1,2023-05-22 11:51:46.000,2023-05-22 11:54:07.000
2046,69916,36372,RURAL,relating to the countryside,adjective,地方の、田舎の,Water harvesting projects are needed in both urban and rural areas.,,111816,69916,1618,414933,293488,0,69,69,82,1,1,2023-05-22 11:51:46.000,2024-07-02 01:59:10.000
2047,32137,15815,UNKNOWN,being unfamiliar or not known,adjective,不明の、未知の,"There have been no casualties, but the cause of the fire is still unknown.",,49186,32137,6,418141,328998,0,7669,70,90,0,1,2023-05-22 11:51:46.000,2024-04-25 14:45:05.000
2048,41905,21027,REPUTATION,opinion people have,noun,評判,I like that the company has a good reputation.,,65460,41905,2026,414400,125971,0,79,73,84,1,1,2023-05-22 11:51:46.000,2023-05-22 11:54:09.000
2049,51660,25634,GRAND,being very large and impressive,adjective,盛大な,There are no grand celebrations here.,,84766,51660,1953,407480,140540,0,88,65,106,1,1,2023-05-22 11:51:46.000,2024-06-19 17:08:14.000
