"rank","id","sharedMeaningId","label","definition","POS","japaneseTranslation","canonicalLine","dialogLineId","id","wordId","wordHeadId","wordRootId","wordInstanceId","wordUsageCount","headUsageCount","rootUsageCount","instanceUsageCount","headPick","rootPick","created","modified"
1364,47418,23689,MASS,involving many people or things,adjective,多数の、大規模な,That should have mass appeal for all age groups.,,75969,47418,1607,410328,87762,0,234,153,222,1,1,2023-05-22 11:51:46.000,2024-07-08 05:13:23.000
1365,7380,2836,AID,something that provides help,noun,支援,"In China, Beijing sends aid to flood victims in Pakistan.",,11796,7380,1452,3966,211413,0,244,164,187,0,0,2023-05-22 11:51:46.000,2023-05-22 11:51:46.000
1366,12392,5145,THEORY,idea to explain something,noun,理論,That's an interesting theory.,,19872,12392,826,417281,116826,0,177,153,157,1,1,2023-05-22 11:51:46.000,2024-04-29 14:37:07.000
1367,43136,21654,COLLECTION,objects brought together in one place,noun,収集物,Perhaps you will add this camera to your Lego collection.,,67704,43136,1333,403175,311907,0,614,121,129,0,0,2023-05-22 11:51:46.000,2023-05-22 11:51:46.000
1367,34433,17092,COLLECTION,the act or process of bringing things together for a particular reason,noun,収集,And it's not only got regular trash collection...,,52733,34433,1333,403176,139445,0,614,34,35,0,1,2023-05-22 11:51:46.000,2023-05-22 11:54:07.000
1368,99237,55494,PAYMENT,the act of giving money for something,noun,支払い,"Hi, I got a message about a late payment.",,150975,99237,150,412298,299946,0,1238,135,105,0,1,2023-05-22 11:51:46.000,2024-05-06 15:32:14.000
1369,34548,17146,BUTTON,an object pressed to make a thing work,noun,スイッチ、突起部分,What button do I push?,,52948,34548,1705,402288,69682,0,183,160,165,1,1,2023-05-22 11:51:46.000,2023-05-22 11:54:07.000
1370,32284,15885,EXCHANGE,give and receive,verb,交換する,It's also traditional to exchange flowers and gifts.,,49420,32284,1408,406017,56348,0,173,106,85,0,0,2023-05-22 11:51:46.000,2023-05-22 11:51:46.000
1370,50091,24929,EXCHANGE,a trade,noun,為替,"In addition, there was no opportunity for the exchange of goods.",,81634,50091,1408,316498,72921,0,173,52,50,0,0,2023-05-22 11:51:46.000,2023-05-22 11:51:46.000
1371,34361,17056,STOCK,a company share,noun,株,An investor will want to buy a stock at a cheap price.,,52600,34361,733,171967,134220,0,217,157,110,0,0,2023-05-22 11:51:46.000,2023-05-22 11:51:46.000
1372,12057,5016,APPROVE,to allow or officially agree to something,verb,承認する,...on whether to approve or reject her Brexit deal with the European Union.,,19038,12057,1630,400819,284606,0,234,148,51,0,0,2023-05-22 11:51:46.000,2024-05-29 12:36:05.000
1373,18169,7962,TAXI,a car with a driver,noun,タクシー,She gets around the city by taxi.,,29582,18169,490,417099,70830,0,174,142,158,0,0,2023-05-22 11:51:46.000,2023-05-22 11:51:46.000
1374,51274,25471,LITERALLY,used to stress that something is true,adverb,文字通り,People literally live in apartments smaller than your SUV.,,84000,51274,4432,409851,321937,0,190,144,206,1,1,2023-05-22 11:51:46.000,2024-06-26 13:19:20.000
1375,49235,24528,MASTER,to learn to do something very well,verb,熟達する,master new musical instruments;,,79743,49235,1565,410339,307602,0,232,46,37,0,0,2023-05-22 11:51:46.000,2023-05-22 11:51:46.000
1375,34505,17129,MASTER,a person who is very skilled,noun,名人、達人,"He's a master, a combination of teacher and mentor.",,52867,34505,1565,410336,135672,0,232,36,27,0,1,2023-05-22 11:51:46.000,2023-05-22 11:54:08.000
1375,34508,17130,MASTER,person with power or control over others,noun,主人,His master was a cruel and evil man.,,52874,34508,1565,410335,325899,0,232,74,95,1,1,2023-05-22 11:51:46.000,2023-05-22 11:54:08.000
1376,37410,18592,BRIGHT,having a striking color,adjective,明るい、生き生きした,I really like her bright blue eyes and dark hair.,,57937,37410,29883,22599,98747,0,252,34,37,0,1,2023-05-22 11:51:46.000,2023-05-22 11:53:42.000
1376,44408,22314,BRIGHT,having a lot of light,adjective,明るい,The star is very bright.,,69895,44408,29883,402111,54303,0,252,118,159,1,1,2023-05-22 11:51:46.000,2023-05-22 11:54:07.000
1377,39706,19843,CIRCLE,a round shape,noun,円,They make a circle with their hands.,,61781,39706,1181,402890,121931,0,229,148,136,0,0,2023-05-22 11:51:46.000,2023-05-22 11:51:46.000
1378,32035,15760,CATEGORY,a group of things,noun,部門、部類,Rugby fits into this category.,,49038,32035,1387,402588,66240,0,178,150,122,0,0,2023-05-22 11:51:46.000,2023-05-22 11:51:46.000
1379,49207,24512,TRANSPORT,the act of moving things from one place to another,noun,移動、移送,"The first method of transport was, of course, walking.",,79686,49207,2201,417724,271737,0,294,72,94,0,1,2023-05-22 11:51:46.000,2024-05-10 14:34:41.000
1379,47437,23699,TRANSPORT,to bring to another place,verb,運ぶ,Pilots fly airplanes to transport passengers and goods.,,76008,47437,2201,433418,342194,0,294,74,41,0,1,2023-05-22 11:51:46.000,2024-04-30 16:58:16.000
1380,42520,21316,INDEPENDENCE,the state of being free,noun,独立,Scotland voted against independence by a small majority.,,66676,42520,1976,408627,313450,0,157,157,173,0,0,2023-05-22 11:51:46.000,2023-05-22 11:51:46.000
1381,46000,23000,PROPOSAL,a plan that is suggested,noun,提案、計画,"What's your proposal, Ms. Chen?",,73140,46000,1476,413428,65066,0,366,153,135,1,1,2023-05-22 11:51:46.000,2024-06-21 13:51:15.000
1382,16442,7130,DELIVERY,the act of bringing things to places,noun,配達,And we know that customers like fast delivery.,,26726,16442,1319,404535,137368,0,466,145,146,1,1,2023-05-22 11:51:46.000,2023-05-22 11:54:07.000
1383,44905,22539,WEB,the online collection of linked files,noun,ウェブ,Would you like me to search the web?,,70892,44905,3048,418746,90891,0,195,154,224,0,0,2023-05-22 11:51:46.000,2023-05-22 11:51:46.000
1384,34355,17054,DEBT,the amount of money that you owe,noun,借金,Tens of millions of young Americans are drowning in student loan debt.,,52588,34355,1559,404370,46961,0,161,149,167,1,1,2023-05-22 11:51:46.000,2024-07-01 12:57:06.000
1385,13383,5627,POSSIBILITY,an opportunity to develop successfully,noun,可能性,"And there is a whole world waiting for you, filled with possibilities.",,21634,13383,277,419955,296856,0,1269,68,1,0,0,2023-05-22 11:51:46.000,2023-05-22 11:51:46.000
1385,16282,7074,POSSIBILITY,something that might happen,noun,可能性,Good leaders anticipate the possibility of failure from the start.,,26390,16282,277,412939,80699,0,1269,79,91,0,1,2023-05-22 11:51:46.000,2023-05-22 11:54:08.000
1386,41544,20840,METAL,a hard substance,noun,金属,It is made of glass and metal!,,64765,41544,1224,410529,323608,0,178,141,161,1,1,2023-05-22 11:51:46.000,2024-05-02 13:46:12.000
1387,50262,24995,ACTUAL,real or true,adjective,実際の,I prefer learning from actual teachers.,,82020,50262,1498,400192,286988,0,2431,144,194,0,0,2023-05-22 11:51:46.000,2023-05-22 11:51:46.000
1388,46350,23167,RATHER,preferably or instead,adverb,むしろ,I think I'd rather go home.,,73858,46350,800,413844,67626,0,214,147,210,0,0,2023-05-22 11:51:46.000,2023-05-22 11:51:46.000
1389,16478,7141,MAINLY,mostly or about the most important,adverb,主に,These people were mainly farmers.,,26804,16478,813,410140,285600,0,791,149,171,0,1,2023-05-22 11:51:46.000,2024-06-24 13:46:16.000
1390,3299,1425,MONITOR,to watch carefully over time,verb,監視する,This watch is used to monitor a user's heart rate and sleeping patterns.,,5893,3299,2001,410792,94579,0,199,138,84,1,1,2023-05-22 11:51:46.000,2023-05-22 11:54:08.000
1391,36827,18290,HONEST,truthful,adjective,正直な,The honest answer is I don't know.,,56934,36827,1203,408172,71550,0,256,143,192,1,1,2023-05-22 11:51:46.000,2024-06-14 14:26:48.000
1392,51266,25470,LIFT,to move to a higher position,verb,持ち上げる,Strong robots can lift and move heavy things easily.,,83976,51266,1079,409751,103568,0,206,102,72,1,1,2023-05-22 11:51:46.000,2023-05-22 11:54:08.000
1392,45127,22637,LIFT,to cancel officially,verb,解除する,"In Thailand, the government prepares to lift emergency rule...",,71353,45127,1079,101938,9181,0,206,34,10,0,0,2023-05-22 11:51:46.000,2023-05-22 11:51:46.000
1392,1433,708,LIFT,to improve the situation that someone is in,verb,持ち上げる,How to lift an entire nation.,,2242,1433,1079,101928,50502,0,206,19,16,0,1,2023-05-22 11:51:46.000,2023-05-22 11:53:52.000
1393,23552,11157,LAYER,piece that lies over or under something,noun,層,The ozone layer in the troposphere is anthropogenic.,,36755,23552,1933,409554,61137,0,156,148,121,0,0,2023-05-22 11:51:46.000,2023-05-22 11:51:46.000
1394,44903,22538,APPLICATION,a computer program,noun,(コンピューター)プログラム,"It's, by far, the most popular application.",,70883,44903,48693,8217,96423,0,560,95,65,0,0,2023-05-22 11:51:46.000,2023-05-22 11:51:46.000
1394,22895,10816,APPLICATION,"a formal, written request for something",noun,応募（書類）,I want to fill out an application.,,35831,22895,36405,400781,321976,0,158,57,51,1,1,2023-05-22 11:51:46.000,2024-05-29 12:36:08.000
1395,44313,22274,APOLOGIZE,to say sorry for something you did,verb,謝罪する,I want to apologize again for the inconvenience.,,69704,44313,3382,400743,58220,0,193,146,128,1,1,2023-05-22 11:51:46.000,2023-05-22 11:54:07.000
1396,24175,11511,UNIFORM,clothes worn by members of a group or team,noun,制服,Let me put on my uniform too.,,37650,24175,1790,418111,117475,0,162,144,96,1,1,2023-05-22 11:51:46.000,2024-05-27 01:13:02.000
1397,98219,54807,FAMILIAR,having knowledge about something,adjective,詳しい,Are you familiar with it?,,149609,98219,1400,406328,297800,0,203,57,61,0,1,2023-05-22 11:51:46.000,2023-05-22 11:54:07.000
1397,48354,24098,FAMILIAR,easily recognized,adjective,覚えがある,"You seem really familiar to me, like I know you from somewhere.",,77857,48354,1400,406330,324877,0,203,95,135,0,0,2023-05-22 11:51:46.000,2023-05-22 11:51:46.000
1398,1506,733,CONTRIBUTE,to help make something happen,verb,寄与する、貢献する,"I accept that livestock farming does contribute toward global warming,...",,2368,1506,1329,403740,298677,0,250,91,34,0,1,2023-05-22 11:51:46.000,2024-05-13 12:55:51.000
1398,23038,10890,CONTRIBUTE,"to help by giving money, things, help or ideas",verb,貢献する、寄付する,Everyone has to contribute.,,36023,23038,1329,403739,75543,0,250,53,52,1,1,2023-05-22 11:51:46.000,2023-05-22 11:54:07.000
1399,12337,5121,DANGER,something or someone that may cause harm,noun,脅威、危険人物,"According to Mitnick, the biggest danger to security is people.",,19757,12337,1206,404293,146382,0,563,54,12,0,0,2023-05-22 11:51:46.000,2023-05-22 11:51:46.000
1399,68727,35689,DANGER,possibility of something bad happening,noun,危険,"Golden Rabbit said, ""Lion is in danger.""",,109991,68727,1206,404292,105952,0,563,91,128,0,0,2023-05-22 11:51:46.000,2023-05-22 11:51:46.000
1400,29292,14250,SINGER,a person who performs a song,noun,歌手,He is a popular singer.,,44976,29292,626,415780,67175,0,699,146,148,0,1,2023-05-22 11:51:46.000,2023-05-22 11:54:09.000
1401,12940,5422,BLOW,to send air out of the mouth,verb,吹く,You need to blow into the balloon to fill it up with air.,,20811,12940,1372,401816,316889,0,167,56,70,1,1,2023-05-22 11:51:46.000,2023-05-22 11:54:07.000
1401,48043,23956,BLOW,to move with the wind,verb,吹く,The strong winds begin to blow.,,77216,48043,1372,401817,150890,0,167,95,23,0,0,2023-05-22 11:51:46.000,2023-05-22 11:51:46.000
1402,48871,24346,SALT,a white mineral used to flavor food,noun,塩,A reduction in salt can help lower blood pressure.,,79049,48871,1221,415006,315758,0,198,143,178,1,1,2023-05-22 11:51:46.000,2024-06-06 13:45:13.000
1403,44389,22304,THEME,the subject of a talk or written work,noun,主題,"Today's theme is ""effort"".",,69861,44389,1461,417268,6816,0,162,49,29,0,1,2023-05-22 11:51:46.000,2023-05-22 11:54:09.000
1403,32363,15928,THEME,the main idea of a work of art,noun,主題,"Today, I chose the theme of adventure.",,49540,32363,1461,417269,81901,0,162,102,123,1,1,2023-05-22 11:51:46.000,2023-05-22 11:54:09.000
1404,18123,7937,FRIENDLY,kind and helpful,adjective,友好的な,He's got a nice smile and is friendly.,,29511,18123,135,407087,80325,0,2727,143,193,0,1,2023-05-22 11:51:46.000,2024-07-08 07:39:15.000
1405,45602,22834,SAMPLE,a part that shows what something is like,noun,見本,Take a look at this sample.,,72284,45602,1328,415025,309985,0,183,155,114,1,1,2023-05-22 11:51:46.000,2024-04-24 14:29:15.000
1406,87741,47687,ESSENTIAL,necessary,adjective,必要、不可欠な、重要な,Is it essential that everyone attend the meeting?,,135595,87741,1591,405884,69397,0,275,136,185,1,1,2023-05-22 11:51:46.000,2024-05-29 12:49:11.000
1407,24599,11744,MANUFACTURE,to produce goods in large numbers,verb,製造する,"We manufacture and distribute dried fruits, nuts, and cereals.",,38211,24599,3468,410228,89770,0,243,140,26,0,0,2023-05-22 11:51:46.000,2024-05-07 14:54:17.000
1408,90992,49779,SENIOR,a person who is 65 years old or older,noun,高齢者,...to immunize 19 million teenagers and senior citizens for free.,,139697,90992,924,427996,332373,0,182,25,8,0,0,2023-05-22 11:51:46.000,2023-05-22 11:51:46.000
1408,50039,24906,SENIOR,having a higher rank that another,adjective,上級の、先輩の,I'm a senior data scientist.,,81535,50039,924,415357,322017,0,182,114,148,0,0,2023-05-22 11:51:46.000,2023-05-22 11:51:46.000
1409,42887,21509,CONSTANTLY,happening continuously,adverb,絶えず,﻿The human population is constantly growing.,,67299,42887,2013,403615,301082,0,251,148,198,0,0,2023-05-22 11:51:46.000,2023-05-22 11:51:46.000
1410,40574,20328,LOAN,money that was borrowed,noun,融資,The bank will conduct a credit check before your loan gets approved.,,63189,40574,1478,409892,292928,0,135,122,95,1,1,2023-05-22 11:51:46.000,2024-07-01 12:57:22.000
1411,42187,21158,SIGNIFICANT,very important,adjective,重要な,One significant factor is the economy.,,66045,42187,722,415720,71822,0,151,129,179,1,1,2023-05-22 11:51:46.000,2024-07-08 09:12:03.000
1412,35201,17459,HUNT,the act of searching,noun,追跡,The hunt is on for the killer of a park ranger in Washington state's Mount Rainier National Park.,,54185,35201,1872,87286,233730,0,286,50,59,1,1,2023-05-22 11:51:46.000,2024-05-29 07:27:47.000
1412,48107,23984,HUNT,to search for wild animals,verb,狩猟する,They hunt for small animals to eat at night.,,77364,48107,1872,408322,300758,0,286,96,35,0,0,2023-05-22 11:51:46.000,2023-05-22 11:51:46.000
1413,41901,21025,INNOVATION,a new idea,noun,革新,The computer is a remarkable innovation that allows us to do many things at once.,,65454,41901,10653,408800,45031,0,235,136,159,1,1,2023-05-22 11:51:46.000,2024-07-05 06:20:15.000
1414,1899,881,SLIDE,to move,verb,すべる,They run and jump and slide.,,3237,1899,1934,415901,315040,0,180,71,61,1,1,2023-05-22 11:51:46.000,2024-06-19 17:08:20.000
1414,42689,21394,SLIDE,a structure with a slippery surface,noun,すべり台,It was originally an ice slide.,,66982,42689,1934,415900,319502,0,180,27,28,0,1,2023-05-22 11:51:46.000,2023-05-22 11:54:09.000
1414,102376,57862,SLIDE,a single page of a presentation,noun,スライド,Consider putting just one word on the slide by itself.,,155448,102376,1934,220701,55532,0,180,49,20,0,0,2023-05-22 11:51:46.000,2023-05-22 11:51:46.000
1415,45568,22820,REPAIR,the act of fixing something that is broken,noun,修理,"Hi, I'm James with JNC Home Repair.",,72205,45568,1163,414330,296092,0,141,53,37,0,1,2023-05-22 11:51:46.000,2024-04-29 14:43:46.000
1415,44299,22272,REPAIR,to fix something that is broken,verb,修理する,"So, did you repair it?",,69685,44299,1163,414332,292290,0,141,84,54,1,1,2023-05-22 11:51:46.000,2024-04-29 10:24:27.000
1416,35797,17758,CHEAP,costing little money,adjective,安い,...it has to be cheap.,,55232,35797,518,402765,49688,0,344,147,207,1,1,2023-05-22 11:51:46.000,2023-05-22 11:54:07.000
1417,40276,20170,PIG,a pink farm animal kept for its meat,noun,豚,There is a pig in the farm.,,62677,40276,967,412560,70069,0,156,140,122,0,0,2023-05-22 11:51:46.000,2023-05-22 11:51:46.000
1418,44644,22413,EAST,refers to the direction where the sun rises,adjective,東,At least 20 are dead as storms batter Mexico's east and west coasts.,,70371,44644,730,405434,319566,0,183,54,57,0,1,2023-05-22 11:51:46.000,2023-05-22 11:54:07.000
1418,48570,24201,EAST,the direction where the sun rises,noun,東,He'll then make a second pass from east to west.,,78360,48570,730,405433,62189,0,183,97,127,1,1,2023-05-22 11:51:46.000,2024-05-30 07:38:54.000
1419,49208,24513,INVESTIGATION,act of finding more information,noun,調査,The investigation focused on the underlying cause of the fire.,,79689,49208,1523,409076,97331,0,313,151,155,1,1,2023-05-22 11:51:46.000,2023-05-22 11:54:08.000
1420,14309,6146,RARE,not common or not happening often,adjective,珍しい,That's a rare set of coins.,,23064,14309,29734,413828,1328,0,234,139,186,1,1,2023-05-22 11:51:46.000,2024-07-02 15:01:39.000
1421,47648,23786,KNEE,a bending joint on your leg,noun,膝 (ひざ）,He hurt his leg below his knee.,,76416,47648,1167,409369,40652,0,146,144,75,0,0,2023-05-22 11:51:46.000,2024-05-07 14:56:08.000
1422,2325,1066,SHAKE,to move something or someone back and forth or up and down quickly,verb,握手をする,They shake hands when saying hello.,,3960,2325,840,415485,11975,0,204,145,98,0,0,2023-05-22 11:51:46.000,2023-05-22 11:51:46.000
1423,23559,11161,EXTREME,very great in measure or degree,adjective,極端な,"In extreme circumstances, people can lose their memory completely.",,36772,23559,2068,406236,11899,0,421,141,189,0,1,2023-05-22 11:51:46.000,2024-06-27 13:46:45.000
1424,27644,13298,SUCCEED,to do well or achieve what you want,verb,成功する,Do your best and you'll succeed.,,42549,27644,1048,416657,50936,0,164,150,115,1,1,2023-05-22 11:51:46.000,2024-07-05 15:31:31.000
1425,70710,36816,SCENE,the place where something happened,noun,場面,Pakistan has been the scene of several bloody attacks this week.,,112971,70710,732,415126,330972,0,294,84,119,1,1,2023-05-22 11:51:46.000,2024-06-05 01:52:52.000
1425,35763,17737,SCENE,a part of a play or movie,noun,場面,The action scene was exciting.,,55166,35763,732,415125,59094,0,294,63,51,0,1,2023-05-22 11:51:46.000,2023-05-22 11:54:09.000
1426,41260,20715,ILLEGAL,not allowed by the laws or rules,adjective,違法の,"It is illegal to smoke on this flight, including electronic cigarettes.",,64318,41260,810,408414,64641,0,383,137,167,1,1,2023-05-22 11:51:46.000,2024-07-08 09:12:29.000
1427,32714,16127,ERA,a period of time,noun,時代,﻿It's the end of an era for the internet.,,50059,32714,1566,405845,67587,0,132,130,158,1,1,2023-05-22 11:51:46.000,2024-06-24 13:50:09.000
1428,31829,15647,EMOTIONAL,relating to or showing feelings,adjective,感情的な,I wanted it to be very dramatic and emotional.,,48694,31829,1667,405646,148685,0,345,141,180,0,0,2023-05-22 11:51:46.000,2023-05-22 11:51:46.000
1429,47611,23771,GUN,a metal weapon that shoots bullets,noun,銃,He fired a bullet from his gun.,,76317,47611,571,407665,119501,0,152,139,134,1,1,2023-05-22 11:51:46.000,2023-05-22 11:54:08.000
1430,51803,25702,FAT,an oily solid or liquid substance in food,noun,脂肪,"Just one fast food meal can contain an entire day's worth of calories, sodium and fat.",,85067,51803,462,434936,344803,0,221,47,44,0,1,2023-05-22 11:51:46.000,2024-05-21 10:21:30.000
1430,99443,55641,FAT,having a lot of extra flesh on your body,adjective,太った,The fat cat sat on a mat.,,151241,99443,462,406392,308246,0,221,91,112,1,1,2023-05-22 11:51:46.000,2024-07-04 01:16:11.000
1431,44947,22564,DESIGNER,a person who plans the look of something,noun,設計者、デザイナー,"For example, a designer works hard to create an elegant design for a new car.",,70995,44947,789,404643,287294,0,1214,148,92,0,1,2023-05-22 11:51:46.000,2023-05-22 11:54:07.000
1432,3073,1341,CONVINCE,to make someone believe something,verb,説得する,"...""that there is only one way I can convince you that I am right.""",,5435,3073,1626,403790,303583,0,154,137,60,0,0,2023-05-22 11:51:46.000,2024-06-04 13:05:07.000
1433,102185,57708,SECURE,free from danger or risk,adjective,安全な,Maybe they could afford a lock for the door and feel secure.,,155182,102185,2055,156478,25842,0,986,66,95,0,1,2023-05-22 11:51:46.000,2024-05-17 14:57:00.000
1433,44075,22143,SECURE,to get something with certainty,verb,保証する,He hopes to secure a position at a publishing house.,,69311,44075,2055,415287,331154,0,986,48,34,0,1,2023-05-22 11:51:46.000,2024-05-21 09:58:35.000
1433,14569,6292,SECURE,to make something safe from harm,verb,安全にする,And how do you secure their privacy?,,23439,14569,2055,415286,107386,0,986,18,14,0,1,2023-05-22 11:51:46.000,2024-05-27 13:05:14.000
1434,100644,56520,LEADERSHIP,the quality of guiding or managing well,noun,指導力、統率力,Leadership is motivating others in a group.,,153024,100644,174,409573,304968,0,1459,142,191,0,0,2023-05-22 11:51:46.000,2023-05-22 11:51:46.000
1435,42295,21203,CHAIN,a group of businesses under one ownership,noun,チェーン,The coffee chain is continuing its push to go green.,,66305,42295,1524,29375,265395,0,164,62,58,0,1,2023-05-22 11:51:46.000,2024-06-10 13:09:58.000
1435,66761,34534,CHAIN,series of connected things or people,noun,連鎖,They're at the top of the food chain.,,107236,66761,1524,402675,98102,0,164,71,71,1,1,2023-05-22 11:51:46.000,2024-06-07 12:47:14.000
1436,1087,529,APPEARANCE,how someone or something looks to others,noun,外見,"...and she checked your hands' functionality and appearance,...",,1647,1087,231,400764,273086,0,534,96,119,0,0,2023-05-22 11:51:46.000,2023-05-22 11:51:46.000
1436,35197,17457,APPEARANCE,an act of being seen or heard by the public,noun,登場,Even a giraffe makes an appearance.,,54178,35197,231,400763,29727,0,534,45,36,0,1,2023-05-22 11:51:46.000,2023-05-22 11:54:07.000
1437,50958,25336,REFORM,an improvement,noun,改善、改革,And we intend to pass regulatory reform through Congress.,,83363,50958,939,414113,136126,0,173,149,100,0,0,2023-05-22 11:51:46.000,2023-05-22 11:51:46.000
1438,61995,31543,CLOTHING,things worn to cover people's bodies,noun,衣類,"Make sure you choose your clothing wisely, business attire is appropriate.",,100922,61995,6280,33591,191457,0,139,137,173,1,1,2023-05-22 11:51:46.000,2024-04-25 14:40:33.000
1439,45172,22658,PARTICIPANT,a person actively involved in something,noun,参加者,Every participant will receive a gift.,,71448,45172,933,412167,90672,0,137,137,27,0,0,2023-05-22 11:51:46.000,2023-05-22 11:51:46.000
1440,6209,2523,COMMERCIAL,used for selling things,adjective,商業の,So what happens in commercial business?,,10332,6209,3544,403274,54219,0,198,87,114,1,1,2023-05-22 11:51:46.000,2024-06-05 13:20:08.000
1440,6210,2524,COMMERCIAL,a radio or television advertisement,noun,コマーシャル、広告放送,How about making a TV commercial to advertise it?,,10334,6210,3544,403276,99244,0,198,53,25,0,0,2023-05-22 11:51:46.000,2023-05-22 11:51:46.000
1441,57231,28823,LIP,Mouth edge.,noun,唇,I bit my lip.,,93930,57231,1431,409826,315139,0,148,148,56,0,0,2023-05-22 11:51:46.000,2023-05-22 11:51:46.000
1442,29340,14276,PIANO,an instrument with black and white keys,noun,ピアノ,I enjoy playing the piano in my free time.,,45068,29340,983,412535,87481,0,141,129,153,0,0,2023-05-22 11:51:46.000,2023-05-22 11:51:46.000
1443,26454,12712,PREDICT,to say what will happen in the future,verb,予測する,Analysts predict it could double again by 2012.,,40804,26454,1444,413050,56520,0,255,143,118,1,1,2023-05-22 11:51:46.000,2024-04-25 14:44:34.000
1444,70861,36903,TRANSFORM,to completely change something,verb,一変させる,Stories that will transform the way we do business and the way we live.,,113219,70861,1939,417697,95196,0,194,131,73,1,1,2023-05-22 11:51:46.000,2024-05-27 13:05:13.000
1445,11396,4692,ASSET,something a person or company owns,noun,資産,"NFTs are a type of digital asset that has surged in popularity this year,...",,17986,11396,1910,401046,304744,0,140,87,22,0,0,2023-05-22 11:51:46.000,2023-05-22 11:51:46.000
1445,41975,21056,ASSET,a useful person or thing,noun,資産,...who consider international employees to be a valuable asset.,,65584,41975,1910,401047,289922,0,140,52,57,0,1,2023-05-22 11:51:46.000,2024-05-10 14:25:51.000
1446,49746,24775,INCIDENT,an event that is unusual or important,noun,事件,The incident is not linked to terrorism.,,80866,49746,1603,408569,59648,0,136,133,125,1,1,2023-05-22 11:51:46.000,2024-05-02 13:38:28.000
1447,47341,23647,PARTICIPATE,to become involved in an activity,verb,参加する,Students can participate in the painting during their lunch breaks.,,75796,47341,1397,412168,42963,0,197,143,106,1,1,2023-05-22 11:51:46.000,2024-06-03 12:34:23.000
1448,46824,23412,PEN,a writing or drawing object using ink,noun,ペン,He is writing with a pen.,,74820,46824,634,412345,110935,0,146,139,123,1,1,2023-05-22 11:51:46.000,2024-05-17 11:43:14.000
1449,29301,14256,SECRETARY,a person who works in an office,noun,秘書,She's a very good secretary.,,44988,29301,1155,415269,117594,0,157,41,37,0,1,2023-05-22 11:51:46.000,2023-05-22 11:54:09.000
1449,51579,25588,SECRETARY,the head of a government department,noun,長官、秘書,US Defense Secretary Robert Gates.,,84601,51579,1155,415270,312807,0,157,103,118,1,1,2023-05-22 11:51:46.000,2023-05-22 11:54:09.000
1450,71101,37025,INJURY,physical damage done to a person,noun,怪我,She moved in a year ago after a hip injury.,,113602,71101,2430,408785,66764,0,632,140,70,0,0,2023-05-22 11:51:46.000,2024-05-21 10:27:27.000
1451,50340,25034,REFUSE,to not do or accept something,verb,拒絶する,I refuse to sit here any longer.,,82199,50340,1015,414133,41818,0,155,144,60,0,0,2023-05-22 11:51:46.000,2024-05-01 09:33:14.000
